Institution Name;English Institution Name;Country Code;Institution Category - English;Total students enrolled ISCED 5-7;Total students enrolled at ISCED 8
Universiteti i Tiranës;University of Tirana;AL;university;27284;1110
Universiteti Politeknik i Tiranës;Polytechnic University of Tirana;AL;university;14117;232
Universiteti Bujqësor i Tiranës;Agricultural University of Tirana;AL;university;10465;262
"Universiteti i Elbasanit ""Aleksandër Xhuvani""";University of Elbasan, Aleksander Xhuvani;AL;university;12992;29
"Universiteti i Shkodrës ""Luigj Gurakuqi""";"University of Shkodra ""Luigj Gurakuqi""";AL;university;7915;12
"Universiteti ""Eqrem Çabej"", Gjirokastër";"University ""Eqrem Çabej"" Gjirokastra";AL;university;1616;a
"Universiteti ""Fan S. Noli"", Korçë";"""Fan. S. Noli"" University of Korçë";AL;university;4465;11
"Universiteti i Vlorës, ""Ismail Qemali""";"""Ismail Qemali"" University of Vlora";AL;university;8787;a
"Universiteti ""Aleksandër Moisiu"", Durrës";"""Aleksandër Moisiu"" University of Durrës";AL;university;15981;19
Universiteti i Arteve;University of Arts;AL;university;990;a
Universiteti i Sporteve të Tiranës;Sports University of Tirana;AL;university;1349;16
Universiteti i Mjekësisë, Tiranë;University of Medicine, Tirana;AL;university;7427;m
Universiteti i New York-ut në Tiranë;University of New York, Tirana;AL;university;706;m
"Universiteti ""Albanian University""";Albanian University;AL;university;6965;m
"Universiteti Katolik ""Zoja e Këshillit të Mirë""";Catholic University Lady of Good Counsel;AL;university;1980;m
Universiteti Europian i Tiranës;European University of Tirana;AL;university;4210;m
"Universiteti ""Aldent""";"""Aldent"" University";AL;university;1245;a
Universiteti Polis;Polis University;AL;university;673;m
"Universiteti ""EPOKA""";"""EPOKA"" University";AL;university;1555;m
"Universiteti ""Mesdhetar i Shqipërisë""";Mediterranean University of Albania;AL;university;1005;a
EPITECH ALBANIA;EPITECH ALBANIA;AL;university;m;a
"Shkolla e lartë universitare, jopublike, Universiteti ""Marin Barleti""";Marin Barleti University;AL;higher education institution;1139;m
"Shkolla e Larte ""Nehemia""";"HEI ""Nehemia""";AL;higher education institution;0;a
Universiteti Metropolitan Tirana;Metropolitan Tirana University;AL;university;729;a
Akademia e Forcave të Armatosura;Academy of Armed Forces;AL;academy;0;m
Akademia e Sigurisë;Security Academy;AL;academy;m;a
"Akademia e Filmit dhe Multimedias ""Marubi""";"Academy of Film & Multimedia ""Marubi""";AL;academy;15;a
"Kolegji Universitar ""Luarasi""";University College Luarasi;AL;college;595;a
"Kolegji Universitar ""Qiriazi""";"University College ""Qiriazi""";AL;university college;0;a
"Kolegji Universitar ""WISDOM""";University College WISDOM;AL;university college;322;a
Akademia IVODENT;IVODENT Academy;AL;college;16;a
"Kolegji Universitar ""Pavarësia Vlorë""";"University College ""Pavarësia Vlorë""";AL;university college;409;a
"Kolegji Universitar ""LOGOS""";LOGOS University College;AL;university college;352;a
Tirana Business University College;Tirana Business University College;AL;university college;465;a
"Kolegji Universitar ""Bedër""";"University College ""Bedër""";AL;university college;755;a
"Kolegji Universitar ""I Biznesit""";University College of Business;AL;university college;284;a
"Kolegji Universitar ""REALD""";"University College ""REALD""";AL;university college;337;a
"Kolegji Universitar ""Instituti Kanadez i Teknologjisë""";"University College ""Canadian Institute of Technology""";AL;university college;415;a
Kolegji Profesional i Tiranës;Professional College of Tirana;AL;higher vocational college;342;a
Qendra e Studimeve Albanologjike;Center of Albanological Studies;AL;academy;0;m
Universität Wien;University of Vienna;AT;Public university;74010,586923095;6873,710642549
Universität Graz;University of Graz;AT;Public university;23722,784468774;1509,844708995
Universität Innsbruck;University of Innsbruck;AT;Public university;23822,697242572;2334,814718615
Universität Salzburg;University of Salzburg;AT;Public university;14020,008047265;1206,492857143
Technische Universität Wien;Vienna University of Technology;AT;Public university;24471,963033391;2170,156613757
Technische Universität Graz;Graz University of Technology;AT;Public university;11528,092965368;1200,613227513
Montanuniversität Leoben;University of Mining Leoben;AT;Public university;3377,356349206;387,80952381
Universität für Bodenkultur Wien;University of Natural Resources and Life Sciences, Vienna;AT;Public university;10114,979274892;900,361279461
Veterinärmedizinische Universität Wien;University of Veterinary Medicine Vienna;AT;Public university;1724,702380952;295,166666667
Wirtschaftsuniversität Wien;Vienna University of Economics and Business;AT;Public university;19770,874840845;822,615049303
Universität Linz;University of Linz;AT;Public university;16133,252657528;1221,481150794
Universität Klagenfurt;University of Klagenfurt;AT;Public university;8127,367566693;785,738492063
Universität für Weiterbildung Krems;Danube University Krems;AT;Public university;8471,861904762;8
Medizinische Universität Wien;Medical University of Vienna;AT;Public university;5369,281203008;1303,196560847
Medizinische Universität Graz;Medical University of Graz;AT;Public university;3217,004761905;346,569047619
Medizinische Universität Innsbruck;Medical University of Innsbruck;AT;Public university;2505,416603535;305,833333333
Akademie der bildenden Künste Wien;Academy of Fine Arts Vienna;AT;Public university;1033,288888889;199,266666667
Universität für angewandte Kunst Wien;University of Applied Arts Vienna;AT;Public university;1153,202020202;200,892857143
Universität für Musik und darstellende Kunst Wien;University of Music and Performing Arts in Vienna;AT;Public university;1973,18452381;149,916666667
Universität Mozarteum Salzburg;University of Music and Dramatic Arts Mozarteum Salzburg;AT;Public university;1298,605555556;78,833333333
Universität für Musik und darstellende Kunst Graz;University of Music and Performing Arts Graz;AT;Public university;1383,308730159;80,25
Universität für künstlerische und industrielle Gestaltung Linz;University of Art and Design Linz;AT;Public university;974,014430014;75,333333333
Katholische Privatuniversität Linz;Catholic Private University Linz;AT;Private university;269,319047619;24,833333333
Private Universität für Gesundheitswissenschaften, Medizinische Informatik und Technik;Private University for Health Sciences, Medical Informatics and Technology;AT;Private university;726,616666667;104
Paracelsus Medizinische Privatuniversität Salzburg;Paracelsus Medical University;AT;Private university;868,666666667;93,5
Webster University Vienna - Private University;Webster University Vienna - Private University;AT;Private university;363,2;a
Anton Bruckner Privatuniversität;Anton Bruckner Private University;AT;Private university;553,2;a
NDU New Design University Privatuniversität St. Pölten;New Design University St. Pölten (NDU);AT;Private university;315,666666667;a
Musik und Kunst Privatuniversität der Stadt Wien;Music and Arts University of the City of Vienna;AT;Private university;540,866666667;a
Sigmund Freud Privatuniversität Wien;Sigmund Freud Private University Vienna;AT;Private university;2739,179411765;174,666666667
MODUL University Vienna;MODUL University Vienna;AT;Private university;332,833333333;11
Privatuniversität Schloss Seeburg;Private University Schloss Seeburg;AT;Private university;431,5;a
Private Pädagogische Hochschule Stiftung Burgenland;University of Education in Burgenland;AT;University college of teacher education;642,16504329;a
Pädagogische Hochschule Kärnten;University College of Teacher Education, Carinthia;AT;University college of teacher education;766,34469697;a
Pädagogische Hochschule Niederösterreich;;AT;University college of teacher education;2607,907045134;a
Pädagogische Hochschule Oberösterreich;University of Education, Upper Austria;AT;University college of teacher education;1976,52978817;a
Private Pädagogische Hochschule der Diözese Linz;Private University College of Education of the Diocese of Linz;AT;University college of teacher education;1541,901415154;a
Pädagogische Hochschule Salzburg Stefan Zweig;Salzburg University of Education Stefan Zweig;AT;University college of teacher education;835,653327131;a
Pädagogische Hochschule Steiermark;University of Teacher Education Styria;AT;University college of teacher education;1911,157045732;a
Kirchliche Pädagogische Hochschule der Stiftung der Diözese Graz-Seckau;Catholic University College for Education Graz;AT;University college of teacher education;692,220093795;a
Pädagogische Hochschule Tirol;Pedagogical University Tyrol;AT;University college of teacher education;1181,34792291;a
Kirchliche Pädagogische Hochschule Edith Stein;;AT;University college of teacher education;542,686811799;a
Pädagogische Hochschule Vorarlberg;;AT;University college of teacher education;672,831256244;a
Pädagogische Hochschule Wien;University College of Teacher Education in Vienna;AT;University college of teacher education;3966,942026819;a
Kirchliche Pädagogische Hochschule Wien/Krems;Christian University College of Teacher Education Vienna/Krems;AT;University college of teacher education;3793,26321119;a
Hochschule für Agrar- und Umweltpädagogik Wien;University College for Agrarian and Environmental Pedagogy;AT;University college of teacher education;489,366666667;a
Fachhochschule Burgenland GmbH;University of Applied Sciences Burgenland;AT;University of applied sciences;2853,015451215;a
Fachhochschule Salzburg GmbH;Salzburg University of Applied Sciences;AT;University of applied sciences;2865,283333333;a
Fachhochschule St. Pölten GmbH;University of Applied Sciences St. Pölten;AT;University of applied sciences;2623,466666667;a
CAMPUS 02 Fachhochschule der Wirtschaft GmbH;CAMPUS 02 University of Applied Sciences;AT;University of applied sciences;1247,743290043;a
Fachhochschule des bfi Wien GmbH;University of Applied Science bfi Vienna Ltd.;AT;University of applied sciences;2017,124242424;a
MCI - Management Center Innsbruck Internationale Hochschule GmbH;Management Center Innsbruck Ltd.;AT;University of applied sciences;2979,866666667;a
Bundesministerium für Landesverteidigung und Sport, Sektion II, Gruppe Ausbildungswesen, Ausbildung A;Federal Ministry of Defence;AT;University of applied sciences;124,833333333;a
FHS Kufstein Tirol Bildungs GmbH;Kufstein University of Applied Sciences;AT;University of applied sciences;1733,25;a
FH OÖ Studienbetriebs GmbH;University of Applied Sciences Upper Austria;AT;University of applied sciences;5728,076190476;a
Fachhochschule Campus Wien;FH Campus Wien - University of Applied Sciences;AT;University of applied sciences;5458,724242424;a
Lauder Business School;Lauder Business School;AT;University of applied sciences;354,5;a
FHG – Zentrum für Gesundheitsberufe Tirol GmbH;Health University of Applied Sciences Tyrol;AT;University of applied sciences;670,833333333;a
FFH Gesellschaft zur Erhaltung und Durchführung von Fachhochschul-Studiengängen mbH;Ferdinand Porsche Fern FH-Studiengänge;AT;University of applied sciences;665,233333333;a
FHWien der WKW;University of Applied Sciences for Management & Communication;AT;University of applied sciences;3218,412301587;a
Fachhochschule Vorarlberg GmbH;Vorarlberg University of Applied Sciences;AT;University of applied sciences;1403,5;a
Fachhochschule Technikum Wien;University of Applied Sciences Technikum Vienna;AT;University of applied sciences;4130,30952381;a
IMC Fachhochschule Krems GmbH;IMC University of Applied Sciences Krems;AT;University of applied sciences;2645,920634921;a
Fachhochschule Wiener Neustadt für Wirtschaft und Technik GmbH;University of Applied Sciences Wiener Neustadt for Business and Engineering;AT;University of applied sciences;3578,2;a
Fachhochschule Kärnten;Carinthia University of Applied Sciences;AT;University of applied sciences;2376,878571429;a
FH JOANNEUM Gesellschaft mbH;University of Applied Sciences Joanneum;AT;University of applied sciences;4210,695238095;a
Danube Private University;Danube Private University;AT;Private university;1091,333333333;a
FH Gesundheitsberufe Oberösterreich;University of Applied Sciences for Health Professions Upper Austria;AT;University of applied sciences;796,333333333;a
Karl Landsteiner Privatuniversität für Gesundheitswissenschaften;Karl Landsteiner University of Health Sciences;AT;Private university;119,583333333;a
Université de Namur;University of Namur;BE;University;m;m
Université Saint-Louis - Bruxelles;;BE;University;m;m
Université catholique de Louvain;UCLouvain;BE;University;m;m
Université de Liège;University of Liège;BE;University;m;m
Université de Mons;University of Mons;BE;University;m;m
Université libre de Bruxelles;ULB;BE;University;m;m
Haute Ecole ICHEC - ECAM - ISFSC;ICHEC Brussels Management School - ECAM Business Engineering school - ISFSC;BE;University college;m;m
Haute Ecole Albert Jacquard;Haute Ecole Albert Jacquard;BE;University college;m;m
Haute Ecole Charlemagne;;BE;University college;m;m
Haute Ecole en Hainaut;;BE;University college;m;m
Haute Ecole Robert Schuman;;BE;University college;m;m
Haute Ecole de la Province de Liège;;BE;University college;m;m
Haute Ecole de la Province de Namur;University College of the Province of Namur;BE;University college;m;m
Haute Ecole de la Ville de Liège;;BE;University college;m;m
Haute Ecole Ephec;EPHEC University College;BE;University college;m;m
Haute Ecole Francisco Ferrer;;BE;University college;m;m
Haute Ecole Galilée;;BE;University college;m;m
Haute Ecole Léonard de Vinci;;BE;University college;m;m
Haute Ecole Libre de Bruxelles Ilya Prigogine;;BE;University college;m;m
Haute Ecole Libre Mosane;HELMo University College;BE;University college;m;m
Haute Ecole Louvain en Hainaut;;BE;University college;m;m
Haute Ecole Lucia de Brouckère;;BE;University college;m;m
Haute Ecole Provinciale du Hainaut - Condorcet;HEPH-Condorcet;BE;University college;m;m
Académie des Beaux-Arts de la ville de Tournai;;BE;Arts college;m;m
Académie royale des Beaux-Arts de la Ville de Bruxelles - École supérieure des Arts;Royal Academy of fine-Arts of Brussels;BE;Arts college;m;m
Ecole supérieure des Arts de la Ville de Liège;;BE;Arts college;m;m
Conservatoire royal de musique de Bruxelles;Royal Conservatoire of Brussels;BE;Arts college;m;m
Conservatoire royal de musique de Liège;Conservatoire royal de Liège;BE;Arts college;m;m
Ecole supérieure des Arts du Cirque;Superior School of Circus Arts;BE;Arts college;m;m
Ecole supérieure des Arts - École de Recherche graphique;;BE;Arts college;m;m
Ecole nationale supérieure des Arts visuels de La Cambre;La Cambre;BE;Arts college;m;m
"Ecole supérieure des Arts de l'Image LE 75";;BE;Arts college;m;m
Ecole supérieure des Arts Saint-Luc de Liège;ESA Saint-Luc Liège;BE;Arts college;m;m
Ecole supérieure des Arts Institut Saint-Luc Tournai;;BE;Arts college;m;m
Institut des Arts de Diffusion;;BE;Arts college;m;m
Institut national supérieur des Arts du Spectacle et des Techniques de Diffusion;;BE;Arts college;m;m
Institut supérieur de Musique et de Pédagogie;;BE;Arts college;m;m
Katholieke Universiteit Leuven;KU Leuven;BE;University;44362;5035
Transnationale Universiteit Limburg;Transnational University Limburg;BE;University;1547;140
Universiteit Hasselt;Hasselt University;BE;University;3846;300
Universiteit Antwerpen;University of Antwerp;BE;University;15926;1493
Universiteit Gent;Ghent University;BE;University;35261;3840
Vrije Universiteit Brussel;The Vrije Universiteit Brussel;BE;University;11062;1449
Arteveldehogeschool;University college Arteveldehogeschool;BE;University College/University of Applied Science;12325;a
Erasmushogeschool Brussel;Erasmus University College Brussels;BE;University College/University of Applied Science;5374;a
Hogere Zeevaartschool;Antwerp maritime academy;BE;University College/University of Applied Science;586;a
Hogeschool Gent;University College Ghent;BE;University College/University of Applied Science;13159;a
Hogeschool West-Vlaanderen;Howest, University College West Vlaanderen;BE;University College/University of Applied Science;5388;a
LUCA School of Arts;LUCA School of Arts;BE;University College/University of Applied Science;3029;a
Karel de Grote-Hogeschool - Katholieke Hogeschool Antwerpen;Karel de Grote University College;BE;University College/University of Applied Science;11812;a
Katholieke Hogeschool Vives Noord;Catholic University College Vives Noord;BE;University College/University of Applied Science;3405;a
Thomas More Kempen;Thomas More Kempen;BE;University College/University of Applied Science;7414;a
UC Leuven;UC Leuven;BE;University College/University of Applied Science;8375;a
UC Limburg;UC Limburg;BE;University College/University of Applied Science;4655;a
Katholieke Hogeschool Vives Zuid;Catholic University College Vives Zuid;BE;University College/University of Applied Science;8310;a
Haute Ecole de Namur-Liège-Luxembourg;University College of Namur - Liège - Luxembourg;BE;University college;m;m
Arts²;Arts² Academy of Arts;BE;Arts college;m;m
ODISEE;ODISEE;BE;University College/University of Applied Science;9549;a
AP Hogeschool Antwerpen;AP University College Antwerpen;BE;University College/University of Applied Science;10537;a
Hogeschool PXL;PXL University College;BE;University College/University of Applied Science;7434;a
Thomas More Mechelen-Antwerpen;Thomas More Mechelen-Antwerpen;BE;University College/University of Applied Science;7310;a
Ecole supérieure des Arts - Saint-Luc de Bruxelles;ESA Saint-Luc Bruxelles;BE;Arts college;m;m
Haute Ecole Bruxelles-Brabant;;BE;University college;m;m
"Югозападен университет ""Неофит Рилски""";"South-West University ""Neofit Rilski""";BG;University;9350;288
Американски университет в България;American University in Bulgaria;BG;University;990;a
Колеж по туризъм - Благоевград;Blagoevgrad College of Tourism;BG;College;568;a
Университет “Проф. д-р Асен Златаров”;Burgas Professor Assen Zlatarov University;BG;University;5216;25
Бургаски свободен университет;Burgas Free University;BG;University;1926;13
Икономически университет - Варна;University of Economics - Varna;BG;University;8597;97
Технически университет - Варна;Technical University of Varna;BG;University;5283;118
"Медицински университет ""проф. д-р Параскев Стоянов""";"Varna Medical University ""prof. dr. Paraskev Stoyanov""";BG;University;4807;190
"Варненски свободен университет ""Черноризец Храбър""";"Varna Free University ""Chernorizets Hrabar""";BG;University;6177;143
"Висше военноморско училище ""Н. Й. Вапцаров""";Nikola Vaptsarov Naval Academy’;BG;University;3092;30
"Великотърновски университет ""Св. св. Кирил и Методий""";St. Cyril and St. Methodius University of Veliko Tarnovo;BG;University;9818;361
Националeн военен университет “Васил Левски;Vasil Levski National Military University;BG;University;2290;30
"Стопанска академия ""Д. А. Ценов"" - Свищов";D.A.Tsenov Academy of Economics;BG;University;8478;131
Технически университет - Габрово;Technical University of Gabrovo;BG;University;c;c
Висше училище по мениджмънт;Varna University of Management;BG;College;382;a
Медицински университет - Плевен;Medical University - Pleven;BG;University;2179;58
"Пловдивски университет ""Паисий Хилендарски""";Paisii Hilendarski University of Plovdiv;BG;University;16545;235
Университетът по хранителни технологии;University of Food Technologies – Plovdiv;BG;University;c;c
Аграрен университет – Пловдив;Agricultural University – Plovdiv;BG;University;3235;37
Медицински университет - Пловдив;Medical University of Plovdiv;BG;University;6024;109
Академия за музикално, танцово и изобразително изкуство;Academy of Music, Dance and Fine Arts;BG;University;810;45
Висше училище по агробизнес и развитие на регионите;University of Agribusiness and Rural Development;BG;University;4484;a
Висше училище по сигурност и икономика;University of Security and Economics;BG;College;1874;a
Европейско висше училище по икономика и мениджмънт;European Higher School of Economics and Management;BG;College;1816;a
"Русенски университет ""Ангел Кънчев""";Angel Kanchev University of Ruse;BG;University;7626;154
"Софийски университет ""Св. Климент Охридски""";Sofia University St. Kliment Ohridski;BG;University;22549;1036
Университет за национално и световно стопанство;University of National and World Economy;BG;University;21984;411
Университет по архитектура, строителство и геодезия;University of Architecture, Civil Engineering and Geodesy;BG;University;3306;105
Технически Университет - София;Technical University of Sofia;BG;University;12481;423
Химикотехнологичен и металургичен университет;University of Chemical Technology and Metallurgy;BG;University;2978;135
"Минно-геоложкият университет ""Св. Иван Рилски""";St. Ivan Rilski University of Mining and Geology;BG;University;2899;60
Лесотехнически университет;University of Forestry;BG;University;2674;56
Медицински университет - София;Medical University - Sofia;BG;University;9912;359
"Национална спортна академия “Васил Левски""";National Sports Academy Vasil Levski;BG;University;2915;144
"Национална Академия за Театрално и Филмово Изкуство ""Кръстьо Сарафов""";Krastyo Sarafov National Academy for Theatre and Film Arts;BG;University;684;27
Национална художествена академия;National Academy of Art;BG;University;910;82
"Национална музикална академия ""Проф. П. Владигеров""";"National Academy of Music ""Prof. Pantcho Vladigerov""";BG;University;637;55
Нов Български Университет;New Bulgarian University;BG;University;9919;77
Висше строително училище “Любен Каравелов”;Higher School of Civil Engineering “Lyuben Karavelov“;BG;University;827;25
"Висше транспортно училище ""Тодор Каблешков""";Todor Kableshkov Higher School of Transport;BG;University;2665;54
Академия на МВР;Academy of Ministry of Internal Affairs;BG;University;1263;50
"Военна академия ""Георги Стойков Раковски""";"""G. S. Rakovski"" National Defence Academy";BG;University;841;56
Университет по библиотекознание и информационни технологии;State University of Library Studies and Information Technologies;BG;University;2234;240
Висше училище по телекомуникации и пощи;University of Telecommunications and Post;BG;College;1392;a
Колеж по мениджмънт, търговия и маркетинг;Management, Trade and Marketing College;BG;College;c;c
"Театрален колеж ""Любен Гройс""";Luben Groys Theatre College;BG;College;43;a
Висше училище по застраховане и финанси;Higher school of insurance and finances;BG;University;1412;15
Международно висше бизнес училище;International Business School;BG;University;3336;9
Тракийски Университет;Trakia University;BG;University;6212;85
Шуменски университет “Епископ Константин Преславски”;Konstantin Preslavsky University of Shumen;BG;University;6399;157
Българска академия на науките;Bulgarian Academy of Sciences;BG;Scientific organization;a;615
Европейски политехнически университет - Перник;European Polytechnical University - Pernik;BG;University;40;a
Universität Basel;University of Basel;CH;Cantonal University;10668;2755
Universität Bern;University of Bern;CH;Cantonal University;14022;2772
Université de Fribourg;University of Fribourg;CH;Cantonal University;9330;1317
Université de Genève;University of Geneva;CH;Cantonal University;14498;2567
Université de Lausanne;University of Lausanne;CH;Cantonal University;12281;2172
Universität Luzern;University of Lucerne;CH;Cantonal University;2519;323
Université de Neuchâtel;University of Neuchâtel;CH;Cantonal University;3648;607
Universität Sankt Gallen;University of Sankt Gallen;CH;Cantonal University;8268;671
Universität Zürich;University of Zurich;CH;Cantonal University;20983;5268
Università della Svizzera italiana;Università della Svizzera italiana;CH;Cantonal University;2589;272
Ecole Polytechnique Fédéral de Lausanne;Federal Institute of Technology Lausanne;CH;Federal University of Technology;8212;2099
Eidgenössische Technische Hochschule Zürich;Federal Institute of Technology Zurich;CH;Federal University of Technology;15300;4002
