"Libera Univ. degli Studi ""Maria SS. Assunta"" - LUMSA - Roma";Free University Maria SS. Assunta (LUMSA);IT;University;6234;26
"Università ""Campus Bio-Medico"" di ROMA";Campus Bio-Medico University;IT;University;2159;50
"Università degli Studi di ROMA ""La Sapienza""";Sapienza University of Rome;IT;University;105483;3077
"Università degli Studi di ROMA ""Foro Italico""";"University of Rome ""Foro Italico""";IT;University;2200;29
"Università degli Studi di ROMA ""Tor Vergata""";University of Rome Tor Vergata;IT;University;31724;1099
Università degli Studi EUROPEA di ROMA;European University of Rome;IT;University;940;8
Università Telematica GUGLIELMO MARCONI;Marconi University;IT;Online University;8790;4
Università Telematica UNITELMA SAPIENZA;Unitelma Sapienza;IT;Online University;4817;a
UNICUSANO Università degli Studi Niccolò Cusano -Telematica Roma;University Niccolò Cusano;IT;Online University;20647;m
Università Telematica Internazionale UNINETTUNO;International Online University UNINETTUNO;IT;Online University;10916;a
"Università Telematica ""Universitas MERCATORUM""";Universitas Mercatorum;IT;Online University;331;a
Università degli Studi di SALERNO;University of Salerno;IT;University;35629;375
Università degli Studi di SASSARI;University of Sassari;IT;University;13522;182
Università degli Studi di SIENA;University of Siena;IT;University;16528;319
Università per Stranieri di SIENA;University for Foreigners of Siena;IT;University for Foreigners;1965;26
Università degli Studi di TERAMO;University of Teramo;IT;University;6336;142
Politecnico di TORINO;Politecnico di Torino;IT;Technical University;31032;633
Università degli Studi di TORINO;University of Turin;IT;University;70750;780
"Università Telematica ""LEONARDO da VINCI""";Telematic University Leonardo da Vinci;IT;Online University;677;a
Università degli Studi di TRENTO;University of Trento;IT;University;16271;593
Scuola Internazionale Superiore di Studi Avanzati di TRIESTE;International School for Advanced Studies (SISSA);IT;Higher School;a;346
Università degli Studi di TRIESTE;University of Trieste;IT;University;15450;306
Università degli Studi di UDINE;University of Udine;IT;University;15668;249
"Università degli Studi di URBINO ""Carlo BO""";University of Urbino Carlo Bo;IT;University;14010;117
Università degli Studi INSUBRIA Varese-Como;University of Insubria;IT;University;9838;197
"Università ""Cà Foscari"" VENEZIA";Ca’ Foscari University of Venice;IT;University;20444;323
Università IUAV di VENEZIA;University IUAV of Venice;IT;University;4289;113
"Università degli Studi del PIEMONTE ORIENTALE ""Amedeo Avogadro""-Vercelli";"University of Piemonte Orientale ""Amedeo Avogadro""";IT;University;12130;88
Università degli Studi di VERONA;University of Verona;IT;University;24900;322
Università degli Studi della TUSCIA;University of Tuscia;IT;University;7865;140
Accademia delle Belle Arti di Bari;Academy of fine arts of Bari;IT;Academy of fine art;641;a
Accademia delle Belle Arti di Bologna;Academy of fine arts of Bologna;IT;Academy of fine art;1827;a
Accademia delle Belle Arti di Carrara;Academy of fine arts of Carrara;IT;Academy of fine art;875;a
Accademia delle Belle Arti di Catania;Academy of fine arts of Catania;IT;Academy of fine art;1673;a
Accademia delle Belle Arti di Catanzaro;Academy of fine arts of Catanzaro;IT;Academy of fine art;202;a
Accademia delle Belle Arti di Firenze;Academy of fine arts of Firenze;IT;Academy of fine art;1190;a
Accademia delle Belle Arti di Foggia;Academy of fine arts of Foggia;IT;Academy of fine art;667;a
Accademia delle Belle Arti di Frosinone;Academy of fine arts of Frosinone;IT;Academy of fine art;497;a
"Accademia delle Belle Arti dell'Aquila";"Academy of fine arts of L'Aquila";IT;Academy of fine art;379;a
Accademia delle Belle Arti di Lecce;Academy of fine arts of Lecce;IT;Academy of fine art;572;a
Accademia delle Belle Arti di Macerata;Academy of fine arts of Macerata;IT;Academy of fine art;1126;a
"Accademia delle Belle Arti di Milano ""Brera""";"Academy of fine arts of Milano ""Brera""";IT;Academy of fine art;4767;a
Accademia delle Belle Arti di Napoli;Academy of fine arts of Napoli;IT;Academy of fine art;2937;a
Accademia delle Belle Arti di Palermo;Academy of fine arts of Palermo;IT;Academy of fine art;1534;a
Accademia delle Belle Arti di Reggio Calabria;Academy of fine arts of Reggio Calabria;IT;Academy of fine art;367;a
Accademia delle Belle Arti di Roma;Academy of fine arts of Roma;IT;Academy of fine art;2660;a
"Accademia delle Belle Arti ""Mario Sironi"" - Sassari";"Academy of fine arts ""Mario Sironi"" - Sassari";IT;Academy of fine art;472;a
"Accademia delle Belle Arti di Torino ""Albertina""";"Academy of fine arts of Torino ""Albertina""";IT;Academy of fine art;1637;a
Accademia delle Belle Arti di Urbino;Academy of fine arts of Urbino;IT;Academy of fine art;565;a
Accademia delle Belle Arti di Venezia;Academy of fine arts of Venezia;IT;Academy of fine art;1313;a
"Accademia delle Belle Arti legalmente riconosciuta di BERGAMO ""Carrara""";"Free Academy of fine arts of BERGAMO ""Carrara""";IT;Free Academy of fine arts;148;a
"Accademia delle Belle Arti legalmente riconosciuta di BRESCIA ""Santagiulia""";"Free Academy of fine arts of BRESCIA ""Santagiulia""";IT;Free Academy of fine arts;723;a
"Accademia delle Belle Arti legalmente riconosciuta di BRESCIA ""LABA"" - libera accademia di belle arti";"Free Academy of fine arts of BRESCIA ""LABA"" - libera accademia di belle arti";IT;Free Academy of fine arts;1091;a
"Accademia delle Belle Arti legalmente riconosciuta di COMO ""Aldo Galli""";"Free Academy of fine arts of COMO ""Aldo Galli""";IT;Free Academy of fine arts;194;a
Accademia delle Belle Arti legalmente riconosciuta di CUNEO;Free Academy of fine arts of CUNEO;IT;Free Academy of fine arts;1067;a
"Accademia delle Belle Arti legalmente riconosciuta di GENOVA ""Accademia Ligustica""";"Free Academy of fine arts of GENOVA ""Accademia Ligustica""";IT;Free Academy of fine arts;426;a
"Accademia delle Belle Arti legalmente riconosciuta di MILANO ""NABA"" - nuova accademia di belle arti";"Free Academy of fine arts of MILANO ""NABA"" - nuova accademia di belle arti";IT;Free Academy of fine arts;3262;a
"Accademia delle Belle Arti legalmente riconosciuta di MILANO ""ACME""";"Free Academy of fine arts of MILANO ""ACME""";IT;Free Academy of fine arts;200;a
"Accademia delle Belle Arti legalmente riconosciuta di NOVARA ""ACME""";"Free Academy of fine arts of NOVARA ""ACME""";IT;Free Academy of fine arts;140;a
"Accademia delle Belle Arti legalmente riconosciuta di PERUGIA ""Pietro Vannucci""";"Free Academy of fine arts of PERUGIA ""Pietro Vannucci""";IT;Free Academy of fine arts;515;a
Accademia delle Belle Arti legalmente riconosciuta di RAVENNA;Free Academy of fine arts of RAVENNA;IT;Free Academy of fine arts;132;a
"Accademia delle Belle Arti legalmente riconosciuta di ROMA ""Rome University of Fine Arts""";"Free Academy of fine arts of ROMA ""Rome University of Fine Arts""";IT;Free Academy of fine arts;738;a
"Accademia delle Belle Arti legalmente riconosciuta di S.AGATA LI BATTIATI (CT) ""Abadir"" accademia di belle arti e restauro";"Free Academy of fine arts of S.AGATA LI BATTIATI (CT) ""Abadir""";IT;Free Academy of fine arts;m;a
"Accademia delle Belle Arti legalmente riconosciuta di S.MARTINO DELLE SCALE (PA) ""Abadir""";"Free Academy of fine arts of S.MARTINO DELLE SCALE (PA) ""Abadir""";IT;Free Academy of fine arts;6;a
"Accademia delle Belle Arti legalmente riconosciuta di SANREMO (IM) ""Istituto I. Duncan""";"Free Academy of fine arts of SANREMO (IM) ""Istituto I. Duncan""";IT;Free Academy of fine arts;41;a
"Accademia delle Belle Arti legalmente riconosciuta di SIRACUSA ""Rosario Gagliardi""";"Free Academy of fine arts of SIRACUSA ""Rosario Gagliardi""";IT;Free Academy of fine arts;30;a
"Accademia delle Belle Arti legalmente riconosciuta di STEFANACONI - VIBO VALENTIA ""Fidia""";"Free Academy of fine arts of STEFANACONI - VIBO VALENTIA ""Fidia""";IT;Free Academy of fine arts;185;a
"Accademia delle Belle Arti legalmente riconosciuta di TRAPANI ""Kandinskij""";"Free Academy of fine arts of TRAPANI ""Kandinskij""";IT;Free Academy of fine arts;m;a
"Accademia delle Belle Arti legalmente riconosciuta di VERONA ""Cignaroli""";"Free Academy of fine arts of VERONA ""Cignaroli""";IT;Free Academy of fine arts;636;a
"Accademia delle Belle Arti legalmente riconosciuta di VITERBO ""Lorenzo da Viterbo""";"Free Academy of fine arts of VITERBO ""Lorenzo da Viterbo""";IT;Free Academy of fine arts;40;a
"Accademia Nazionale di Arte Drammatica di ROMA ""Silvio d'Amico""";"National Academy of Drama ""Silvio D'Amico""";IT;National Academy of Drama;146;a
Accademia nazionale di danza di ROMA;National Dance Academy;IT;Higher Institute for Musical and Choreographic Studies;307;a
"Conservatorio di ADRIA (RO) ""Antonio Buzzolla""";"Music Conservatory of ADRIA (RO) ""Antonio Buzzolla""";IT;Higher Institute for Musical and Choreographic Studies;224;a
"Conservatorio di ALESSANDRIA ""Antonio Vivaldi""";"Music Conservatory of ALESSANDRIA ""Antonio Vivaldi""";IT;Higher Institute for Musical and Choreographic Studies;253;a
"Conservatorio di AVELLINO ""Domenico Cimarosa""";"Music Conservatory of AVELLINO ""Domenico Cimarosa""";IT;Higher Institute for Musical and Choreographic Studies;756;a
"Conservatorio di BARI ""Niccolò Piccinni""";"Music Conservatory of BARI ""Niccolò Piccinni""";IT;Higher Institute for Musical and Choreographic Studies;832;a
"Conservatorio di BENEVENTO ""Nicola Sala""";"Music Conservatory of BENEVENTO ""Nicola Sala""";IT;Higher Institute for Musical and Choreographic Studies;734;a
"Conservatorio di BOLOGNA ""Giovan B. Martini""";"Music Conservatory of BOLOGNA ""Giovan B. Martini""";IT;Higher Institute for Musical and Choreographic Studies;548;a
"Conservatorio di BOLZANO ""Claudio Monteverdi""";"Music Conservatory of BOLZANO ""Claudio Monteverdi""";IT;Higher Institute for Musical and Choreographic Studies;303;a
"Conservatorio di BRESCIA ""Luca Marenzio""";"Music Conservatory of BRESCIA ""Luca Marenzio""";IT;Higher Institute for Musical and Choreographic Studies;367;a
"Conservatorio di CAGLIARI ""Pierluigi da Palestrina""";"Music Conservatory of CAGLIARI ""Pierluigi da Palestrina""";IT;Higher Institute for Musical and Choreographic Studies;341;a
"Conservatorio di CAMPOBASSO ""Lorenzo Perosi""";"Music Conservatory of CAMPOBASSO ""Lorenzo Perosi""";IT;Higher Institute for Musical and Choreographic Studies;332;a
"Conservatorio di CASTELFRANCO VENETO (TV) ""Agostino Steffani""";"Music Conservatory of CASTELFRANCO VENETO (TV) ""Agostino Steffani""";IT;Higher Institute for Musical and Choreographic Studies;246;a
"Conservatorio di CESENA (FC) ""Bruno Maderna""";"Music Conservatory of CESENA (FC) ""Bruno Maderna""";IT;Higher Institute for Musical and Choreographic Studies;188;a
"Conservatorio di COMO ""Giuseppe Verdi""";"Music Conservatory of COMO ""Giuseppe Verdi""";IT;Higher Institute for Musical and Choreographic Studies;288;a
"Conservatorio di COSENZA ""Stanislao Giacomantonio""";"Music Conservatory of COSENZA ""Stanislao Giacomantonio""";IT;Higher Institute for Musical and Choreographic Studies;351;a
"Conservatorio di CUNEO ""G.F. Ghedini""";"Music Conservatory of CUNEO ""G.F. Ghedini""";IT;Higher Institute for Musical and Choreographic Studies;298;a
"Conservatorio di FERMO ""Giovambattista Pergolesi""";"Music Conservatory of FERMO ""Giovambattista Pergolesi""";IT;Higher Institute for Musical and Choreographic Studies;262;a
"Conservatorio di FERRARA ""Girolamo Frescobaldi""";"Music Conservatory of FERRARA ""Girolamo Frescobaldi""";IT;Higher Institute for Musical and Choreographic Studies;299;a
"Conservatorio di FIRENZE ""Luigi Cherubini""";"Music Conservatory of FIRENZE ""Luigi Cherubini""";IT;Higher Institute for Musical and Choreographic Studies;490;a
"Conservatorio di FOGGIA ""Umberto Giordano""";"Music Conservatory of FOGGIA ""Umberto Giordano""";IT;Higher Institute for Musical and Choreographic Studies;320;a
"Conservatorio di FROSINONE ""Licinio Refice""";"Music Conservatory of FROSINONE ""Licinio Refice""";IT;Higher Institute for Musical and Choreographic Studies;753;a
"Conservatorio di GENOVA ""Nicolò Paganini""";"Music Conservatory of GENOVA ""Nicolò Paganini""";IT;Higher Institute for Musical and Choreographic Studies;258;a
"Conservatorio di LA SPEZIA ""Giacomo Puccini""";"Music Conservatory of LA SPEZIA ""Giacomo Puccini""";IT;Higher Institute for Musical and Choreographic Studies;174;a
"Conservatorio di L'AQUILA ""Alfredo Casella""";"Music Conservatory of L'AQUILA ""Alfredo Casella""";IT;Higher Institute for Musical and Choreographic Studies;493;a
"Conservatorio di LATINA ""Ottorino Respighi""";"Music Conservatory of LATINA ""Ottorino Respighi""";IT;Higher Institute for Musical and Choreographic Studies;240;a
"Conservatorio di LECCE ""Tito Schipa""";"Music Conservatory of LECCE ""Tito Schipa""";IT;Higher Institute for Musical and Choreographic Studies;490;a
"Conservatorio di MANTOVA ""Lucio Campiani""";"Music Conservatory of MANTOVA ""Lucio Campiani""";IT;Higher Institute for Musical and Choreographic Studies;218;a
"Conservatorio di MATERA ""Egidio R. Duni""";"Music Conservatory of MATERA ""Egidio R. Duni""";IT;Higher Institute for Musical and Choreographic Studies;555;a
"Conservatorio di MESSINA ""Arcangelo Corelli""";"Music Conservatory of MESSINA ""Arcangelo Corelli""";IT;Higher Institute for Musical and Choreographic Studies;377;a
"Conservatorio di MILANO ""Giuseppe Verdi""";"Music Conservatory of MILANO ""Giuseppe Verdi""";IT;Higher Institute for Musical and Choreographic Studies;940;a
"Conservatorio di MONOPOLI (BA) ""Nino Rota""";"Music Conservatory of MONOPOLI (BA) ""Nino Rota""";IT;Higher Institute for Musical and Choreographic Studies;352;a
"Conservatorio di NAPOLI ""S. Pietro a Majella""";"Music Conservatory of NAPOLI ""S. Pietro a Majella""";IT;Higher Institute for Musical and Choreographic Studies;867;a
"Conservatorio di NOVARA ""Guido Cantelli""";"Music Conservatory of NOVARA ""Guido Cantelli""";IT;Higher Institute for Musical and Choreographic Studies;284;a
"Conservatorio di PADOVA ""Cesare Pollini""";"Music Conservatory of PADOVA ""Cesare Pollini""";IT;Higher Institute for Musical and Choreographic Studies;534;a
"Conservatorio di PALERMO ""Vincenzo Bellini""";"Music Conservatory of PALERMO ""Vincenzo Bellini""";IT;Higher Institute for Musical and Choreographic Studies;823;a
"Conservatorio di PARMA ""Arrigo Boito""";"Music Conservatory of PARMA ""Arrigo Boito""";IT;Higher Institute for Musical and Choreographic Studies;576;a
"Conservatorio di PERUGIA ""Francesco Morlacchi""";"Music Conservatory of PERUGIA ""Francesco Morlacchi""";IT;Higher Institute for Musical and Choreographic Studies;338;a
"Conservatorio di PESARO ""Gioacchino Rossini""";"Music Conservatory of PESARO ""Gioacchino Rossini""";IT;Higher Institute for Musical and Choreographic Studies;400;a
"Conservatorio di PESCARA ""Luisa d’Annunzio""";"Music Conservatory of PESCARA ""Luisa d’Annunzio""";IT;Higher Institute for Musical and Choreographic Studies;541;a
"Conservatorio di PIACENZA ""Giuseppe Nicolini""";"Music Conservatory of PIACENZA ""Giuseppe Nicolini""";IT;Higher Institute for Musical and Choreographic Studies;296;a
"Conservatorio di POTENZA ""Gesualdo da Venosa""";"Music Conservatory of POTENZA ""Gesualdo da Venosa""";IT;Higher Institute for Musical and Choreographic Studies;204;a
"Conservatorio di REGGIO CALABRIA ""Francesco Cilea""";"Music Conservatory of REGGIO CALABRIA ""Francesco Cilea""";IT;Higher Institute for Musical and Choreographic Studies;295;a
"Conservatorio di ROMA ""Santa Cecilia""";"Music Conservatory of ROMA ""Santa Cecilia""";IT;Higher Institute for Musical and Choreographic Studies;1169;a
"Conservatorio di ROVIGO ""Francesco Venezze""";"Music Conservatory of ROVIGO ""Francesco Venezze""";IT;Higher Institute for Musical and Choreographic Studies;450;a
"Conservatorio di SALERNO ""G. Martucci""";"Music Conservatory of SALERNO ""G. Martucci""";IT;Higher Institute for Musical and Choreographic Studies;997;a
"Conservatorio di SASSARI ""Luigi Canepa""";"Music Conservatory of SASSARI ""Luigi Canepa""";IT;Higher Institute for Musical and Choreographic Studies;229;a
"Conservatorio di TORINO ""Giuseppe Verdi""";"Music Conservatory of TORINO ""Giuseppe Verdi""";IT;Higher Institute for Musical and Choreographic Studies;539;a
"Conservatorio di TRAPANI ""Antonio Scontrino""";"Music Conservatory of TRAPANI ""Antonio Scontrino""";IT;Higher Institute for Musical and Choreographic Studies;310;a
"Conservatorio di TRENTO ""Francesco A. Bonporti""";"Music Conservatory of TRENTO ""Francesco A. Bonporti""";IT;Higher Institute for Musical and Choreographic Studies;338;a
"Conservatorio di TRIESTE ""Giuseppe Tartini""";"Music Conservatory of TRIESTE ""Giuseppe Tartini""";IT;Higher Institute for Musical and Choreographic Studies;376;a
"Conservatorio di UDINE ""Jacopo Tomadini""";"Music Conservatory of UDINE ""Jacopo Tomadini""";IT;Higher Institute for Musical and Choreographic Studies;280;a
"Conservatorio di VENEZIA ""Benedetto Marcello"" - palazzo pisani";"Music Conservatory of VENEZIA ""Benedetto Marcello""";IT;Higher Institute for Musical and Choreographic Studies;316;a
"Conservatorio di VERONA ""E. F. dall’Abaco""";"Music Conservatory of VERONA ""E. F. dall’Abaco""";IT;Higher Institute for Musical and Choreographic Studies;309;a
"Conservatorio di VIBO VALENTIA ""Fausto Torrefranca""";"Music Conservatory of VIBO VALENTIA ""Fausto Torrefranca""";IT;Higher Institute for Musical and Choreographic Studies;845;a
"Conservatorio di VICENZA ""Arrigo Pedrollo""";"Music Conservatory of VICENZA ""Arrigo Pedrollo""";IT;Higher Institute for Musical and Choreographic Studies;442;a
"Istituto Superiore di Studi Musicali di AOSTA della Valle d'Aosta";"Music Institute of AOSTA della Valle d'Aosta";IT;Music Institute;74;a
"Istituto Superiore di Studi Musicali di BERGAMO ""Gaetano Donizetti""";"Music Institute of BERGAMO ""Gaetano Donizetti""";IT;Music Institute;135;a
"Istituto Superiore di Studi Musicali di CALTANISSETTA ""Vincenzo Bellini""";"Music Institute of CALTANISSETTA ""Vincenzo Bellini""";IT;Music Institute;230;a
"Istituto Superiore di Studi Musicali di CATANIA ""Vincenzo Bellini""";"Music Institute of CATANIA ""Vincenzo Bellini""";IT;Music Institute;515;a
"Istituto Superiore di Studi Musicali di CREMONA ""Claudio Monteverdi""";"Music Institute of CREMONA ""Claudio Monteverdi""";IT;Music Institute;51;a
"Istituto Superiore di Studi Musicali di GALLARATE (VA) ""Giacomo Puccini""";"Music Institute of GALLARATE (VA) ""Giacomo Puccini""";IT;Music Institute;27;a
"Istituto Superiore di Studi Musicali di LIVORNO ""Pietro Mascagni""";"Music Institute of LIVORNO ""Pietro Mascagni""";IT;Music Institute;194;a
"Istituto Superiore di Studi Musicali di LUCCA ""Luigi Boccherini""";"Music Institute of LUCCA ""Luigi Boccherini""";IT;Music Institute;192;a
"Istituto Superiore di Studi Musicali di NOCERA TERINESE (CZ) ""P.I. Tchaikovsky""";"Music Institute of NOCERA TERINESE (CZ) ""P.I. Tchaikovsky""";IT;Music Institute;345;a
"Istituto Superiore di Studi Musicali di PAVIA ""Franco Vittadini""";"Music Institute of PAVIA ""Franco Vittadini""";IT;Music Institute;183;a
"Istituto Superiore di Studi Musicali di RAVENNA ""Giuseppe Verdi""";"Music Institute of RAVENNA ""Giuseppe Verdi""";IT;Music Institute;43;a
"Istituto Superiore di Studi Musicali di RIMINI ""G. Lettimi""";"Music Institute of RIMINI ""G. Lettimi""";IT;Music Institute;45;a
"Istituto Superiore di Studi Musicali di SIENA ""Rinaldo Franci""";"Music Institute of SIENA ""Rinaldo Franci""";IT;Music Institute;100;a
"Istituto Superiore di Studi Musicali di TARANTO ""Giovanni Paisiello""";"Music Institute of TARANTO ""Giovanni Paisiello""";IT;Music Institute;175;a
"Conservatorio di TERAMO ""Gaetano Braga""";"Music Conservatory of TERAMO ""Gaetano Braga""";IT;Higher Institute for Musical and Choreographic Studies;128;a
"Istituto Superiore di Studi Musicali di TERNI ""Giulio Briccialdi""";"Music Institute of TERNI ""Giulio Briccialdi""";IT;Music Institute;130;a
Istituto Superiore per le Industrie Artistiche (ISIA) di FAENZA (RA);ISIA of Faenza;IT;Higher Institutes for Artistic Industries;100;a
Istituto Superiore per le Industrie Artistiche (ISIA) di FIRENZE;ISIA of Firenze;IT;Higher Institutes for Artistic Industries;185;a
Istituto Superiore per le Industrie Artistiche (ISIA) di ROMA;ISIA of Roma;IT;Higher Institutes for Artistic Industries;441;a
Istituto Superiore per le Industrie Artistiche (ISIA) di URBINO (PU);ISIA of Urbino;IT;Higher Institutes for Artistic Industries;217;a
LINK CAMPUS University;Link Campus University;IT;University;1860;a
"Istituto Superiore di Studi Musicali di MODENA e CARPI ""Orazio Vecchi - Antonio Tonelli""";"Music Institute of MODENA e CARPI ""Orazio Vecchi - Antonio Tonelli""";IT;Music Institute;147;a
"Istituto Superiore di Studi Musicali di REGGIO EMILIA e CASTELNOVO NE' MONTI ""Achille Peri e Merulo""";"Music Institute of REGGIO EMILIA e CASTELNOVO NE' MONTI ""Achille Peri e Merulo""";IT;Music Institute;125;a
"Istituto Superiore di Studi Musicali di RIBERA (AG) ""Arturo Toscanini""";"Music Institute of RIBERA (AG) ""Arturo Toscanini""";IT;Music Institute;96;a
Humanitas University;Humanitas University;IT;University;612;23
Gran Sasso Science Institute;Gran Sasso Science Institute;IT;Higher School;a;42
Universität Liechtenstein;University of Liechtenstein;LI;University;619;35
Vilniaus universitetas;Vilnius University;LT;University;17783;839
Vilniaus Gedimino technikos universitetas;Vilnius Gediminas Technical University;LT;University;10221;205
Lietuvos edukologijos universitetas;Lithuanian University of Educational Sciences;LT;University;3524;40
Vilniaus dailes akademija;Vilnius Academy of Arts;LT;University;1620;42
Lietuvos muzikos ir teatro akademija;Lithuanian Academy of Music and Theatre;LT;University;852;34
Mykolo Romerio universitetas;Mykolas Romeris University;LT;University;9575;170
Generolo Jono Žemaicio Lietuvos karo akademija;The General Jonas Zemaitis Military Academy of Lithuania;LT;University;c;c
Kauno technologijos universitetas;Kaunas University of Technology;LT;University;9905;324
Vytauto Didžiojo universitetas;Vytautas Magnus University;LT;University;6719;202
Aleksandro Stulginskio universitetas;Aleksandras Stulginskis University;LT;University;4444;96
Lietuvos sporto universitetas;Lithuanian Sports University;LT;University;1809;49
Klaipedos universitetas;Klaipeda University;LT;University;3823;86
Šiauliu universitetas;Siauliai University;LT;University;2423;39
Viešoji istaiga Vilniaus universiteto Tarptautinio verslo mokykla;International Business School at Vilnius University;LT;University;c;c
Kazimieras Simonavicius University, UAB;Kazimiero Simonaviciaus University;LT;University;552;0
ISM Vadybos ir ekonomikos universitetas, UAB;ISM University of Management and Economics, JSC;LT;University;1601;32
Viešoji istaiga LCC Tarptautinis universitetas;LCC International university;LT;University;477;0
Vilniaus kolegija;Vilnius College;LT;College;6731;a
Vilniaus technologiju ir dizaino kolegija;Vilnius College of Technologies and Design;LT;College;c;c
Kauno kolegija;Kaunas College;LT;College;6853;a
Kauno technikos kolegija;Kaunas Technical College;LT;College;1568;a
Kauno mišku ir aplinkos inžinerijos kolegija;Kaunas College of Forestry and Environmental Engineering;LT;College;971;a
Klaipedos valstybine kolegija;Klaipeda State College;LT;College;3215;a
Lietuvos aukštoji jureivystes mokykla;Lithuanian Maritime Academy;LT;College;1384;a
Alytaus kolegija;Alytaus College;LT;College;c;c
Panevežio kolegija;Panevėžys College;LT;College;1425;a
Šiauliu valstybine kolegija;Siauliai State College;LT;College;2332;a
Marijampoles kolegija;Marijampole College;LT;College;811;a
Utenos kolegija;Utena University of Applied Sciences;LT;College;1843;a
Žemaitijos kolegija;Zemaitija College;LT;College;c;c
Tarptautine teises ir verslo aukštoji mokykla, UAB;International School of Law and Business;LT;College;797;a
Viešoji istaiga Vilniaus verslo kolegija;Vilnius Business College;LT;College;529;a
Vilniaus kooperacijos kolegija, VšI;Vilnius Co-operative College;LT;College;445;a
Viešoji istaiga Kolpingo kolegija;Kolping College;LT;College;269;a
Viešoji istaiga Socialiniu mokslu kolegija;University of Applied Social Sciences;LT;College;2331;a
"Viešoji istaiga ""Europos Humanitarinis Universitetas""";European Humanities University;LT;University;c;c
Vilniaus dizaino kolegija;Vilnius College of Design;LT;College;529;a
V.A. Graiciuno aukštoji vadybos mokykla;V. A. Graiciunas Higher School of Management;LT;College;c;c
Viešoji istaiga Šiaures Lietuvos kolegija;Northern Lithuania College;LT;College;c;c
Viešoji istaiga Lietuvos verslo kolegija;Public Institution Lithuania Business University of Applied Sciences;LT;College;c;c
Lietuvos sveikatos mokslu universitetas;Lithuanian University of Health Sciences;LT;University;6658;261
"Balstoges universiteto filialas ""Ekonomikos-informatikos fakultetas""";"The Branch of the University of Bialystok ""Faculty of Economics and Informatics""";LT;University;405;a
Šv. Ignaco Lojolos kolegija;St. Ignatius of Loyola College;LT;College;c;c
Université du Luxembourg;University of Luxembourg;LU;University;4534;603
LUNEX University;LUNEX University;LU;University;m;a
Latvijas Universitate;University of Latvia;LV;University;12057;693
Rigas Tehniska universitate;Riga Technical University;LV;University;14409;588
Rigas Stradina universitate;Riga Stradinš University;LV;University;8024;214
Latvijas Lauksaimniecibas universitate;Latvia University of Agriculture;LV;University;4039;184
Daugavpils Universitate;Daugavpils University;LV;University;2165;149
Liepajas Universitate;Liepaja University;LV;University;1315;27
Latvijas Kulturas akademija;Latvian Academy of Culture;LV;State institution of higher education;538;18
