Wyższa Szkoła Przedsiębiorczości im. Księcia Kazimierza Kujawskiego;Higher School of Entrepreneurship Prince Kazimierz Kujawski in Inowrocław;PL;Other higher education institutions;191;a
Zachodniopomorski Uniwersytet Technologiczny w Szczecinie;West Pomeranian University of Technology, Szczecin;PL;Technical universities;10159;481
Akademia Sztuki w Szczecinie;The Szczecin Academy of Art;PL;Fine arts academies;677;a
Państwowa Wyższa Szkoła Zawodowa w Koszalinie;State Higher Vocational School in Koszalin;PL;Other higher education institutions;570;a
Wyższa Szkoła Komunikacji Społecznej w Gdyni;Higher School of Social Communication in Gdynia;PL;Other higher education institutions;264;a
Europejska Uczelnia w Warszawie;European University in Warsaw;PL;Other higher education institutions;2211;a
Wyższa Szkoła Rehabilitacji w Warszawie;College of Rehabilitation in Warsaw;PL;Other higher education institutions;2132;a
Wyższa Szkoła Teologiczno-Humanistyczna im. Michała Beliny-Czechowskiego w Podkowie Leśnej;Michał Belina-Czechowski Higher School of Theology and Humanities in Podkowa Leśna;PL;Other higher education institutions;1372;a
Wyższa Szkoła Inżynierii i Zdrowia w Warszawie;Higher School of Engineering and Health in Warsaw;PL;Other higher education institutions;1721;a
Wyższa Szkoła Informatyki i Zarządzania „Copernicus” we Wrocławiu;University of Information Technology and Management „Copernicus” in Wrocław;PL;Other higher education institutions;728;a
Universidade dos Açores;University of the Azores;PT;Public University;2634;67
Universidade do Algarve;University of Algarve;PT;Public University;7020;261
Universidade de Aveiro;University of Aveiro;PT;Public University;11222;1277
Universidade da Beira Interior;University of Beira Interior;PT;Public University;6100;485
Universidade de Coimbra;University of Coimbra;PT;Public University;17608;2444
Universidade de Évora;University of Évora;PT;Public University;5486;748
Universidade Nova de Lisboa;New University of Lisbon;PT;Public University;16266;2163
Universidade da Madeira;University of Madeira;PT;Public University;2671;67
Universidade do Minho;University of Minho;PT;Public University;15383;1742
Universidade do Porto;University of Porto;PT;Public University;25134;3319
Universidade de Trás-os-Montes e Alto Douro;University of Tras-os-Montes and Alto Douro;PT;Public University;5801;416
ISCTE - Instituto Universitário de Lisboa;ISCTE - University Institute of Lisbon;PT;Public University;7772;728
Universidade Aberta;Open University of Portugal;PT;Public University;5187;349
Instituto Politécnico de Beja;Polytechnic Institute of Beja;PT;Public Polytechnic;2508;a
Instituto Politécnico de Bragança;Polytechnic Institute of Bragança;PT;Public Polytechnic;6379;a
Instituto Politécnico de Castelo Branco;Polytechnic Institute of Castelo Branco;PT;Public Polytechnic;3894;a
Instituto Politécnico do Cávado e do Ave;Polytechnic Institute of Cávado and Ave;PT;Public Polytechnic;3895;a
Instituto Politécnico de Coimbra;Polytechnic Institute of Coimbra;PT;Public Polytechnic;9923;a
Instituto Politécnico da Guarda;Polytechnic Institute of Guarda;PT;Public Polytechnic;2565;a
Instituto Politécnico de Leiria;Polytechnic Institute of Leiria;PT;Public Polytechnic;9913;a
Instituto Politécnico de Lisboa;Lisbon Polytechnic Institute (IPL);PT;Public Polytechnic;13007;a
Instituto Politécnico de Portalegre;Polytechnic Institute of Portalegre;PT;Public Polytechnic;1745;a
Instituto Politécnico do Porto;Polytechnic of Porto;PT;Public Polytechnic;17510;a
Instituto Politécnico de Santarém;Polytechnic Institute of Santarém;PT;Public Polytechnic;3634;a
Instituto Politécnico de Setúbal;Polytechnic Institute of Setúbal;PT;Public Polytechnic;5554;a
Instituto Politécnico de Tomar;Polytechnic Institute of Tomar;PT;Public Polytechnic;1909;a
Instituto Politécnico de Viana do Castelo;IPVC - Polytechnic Institute of Viana do Castelo;PT;Public Polytechnic;4020;a
Instituto Politécnico de Viseu;Polytechnic Institute of Viseu;PT;Public Polytechnic;4683;a
Escola Superior Náutica Infante D. Henrique;Portuguese Maritime College Infante D. Henrique;PT;Public Polytechnic;697;a
Escola Superior de Enfermagem de Coimbra;Nursing School of Coimbra;PT;Public Polytechnic;1926;a
Escola Superior de Enfermagem de Lisboa;Lisbon Nursing School;PT;Public Polytechnic;1599;a
Escola Superior de Enfermagem do Porto;Nursing School of Porto;PT;Public Polytechnic;1628;a
Escola Superior de Hotelaria e Turismo do Estoril;Estoril Higher Institute for Tourism and Hotel Studies;PT;Public Polytechnic;1838;a
Academia da Força Aérea;Air Force Academy;PT;Public Military University;119;a
Academia Militar;Military Academy;PT;Public Military University;435;a
Escola Naval;Navy Academy;PT;Public Military University;256;a
Instituto Superior de Ciências Policiais e Segurança Interna;Higher Institute of Police Sciences and Internal Security;PT;Public Military University;293;a
Universidade Católica Portuguesa;Catholic University of Portugal;PT;Private University;9464;627
Escola Superior Artística do Porto;Higher School of Arts of Oporto;PT;Private University;385;a
Escola Universitária Vasco da Gama;Vasco da Gama University School;PT;Private University;211;a
Instituto Universitário da Maia - ISMAI;University Institute of Maia - ISMAI;PT;Private University;3248;13
Instituto Universitário de Ciências da Saúde;University Institute of Health Sciences;PT;Private University;1184;14
Instituto Universitário Egas Moniz;;PT;Private University;1324;a
Instituto Superior de Comunicação Empresarial;School of Business Communication (ISCEM);PT;Private Polytechnic;163;a
Instituto Superior de Estudos Interculturais e Transdisciplinares de Almada;Higher Institute of Intercultural and Transdisciplinary Studies of Almada;PT;Private University;342;a
Instituto Superior de Gestão;ISG - Business & Economics School;PT;Private University;453;a
Universidade Europeia;European University - Laureate International Universities;PT;Private University;3695;73
Instituto Superior de Novas Profissões;Higher Institute of New Professions;PT;Private Polytechnic;180;a
ISPA-Instituto Universitário de Ciências Psicológicas, Sociais e da Vida;ISPA - University Institute of Psychological, Social and Life Sciences;PT;Private University;1340;70
Instituto Superior de Serviço Social do Porto;Higher Institute of Social Work of Oporto;PT;Private University;261;a
Instituto Superior Manuel Teixeira Gomes;Manuel Teixeira Gomes Higher Education Institute;PT;Private University;321;a
Instituto Superior Miguel Torga;Miguel Torga Institute of Higher Education (ISMT);PT;Private University;853;a
Universidade Atlântica;Atlântica University;PT;Private University;795;a
Universidade Autónoma de Lisboa Luís de Camões;Luís de Camões Autonomous University of Lisbon;PT;Private University;1922;86
Universidade Fernando Pessoa;University Fernando Pessoa;PT;Private University;2479;57
Universidade Lusíada;Lusíada University of Lisbon;PT;Private University;1706;35
Universidade Lusófona de Humanidades e Tecnologias;Lusófona University of Humanities and Technologies;PT;Private University;5935;220
Universidade Lusófona do Porto;Lusophone University of Oporto;PT;Private University;1466;41
Universidade Portucalense Infante D. Henrique;Portucalense University Infante D. Henrique;PT;Private University;1661;a
Escola Superior de Artes e Design;ESAD - College of Arts and Design;PT;Private Polytechnic;865;a
Escola Superior de Educação de Fafe;Higher School of Education of Fafe;PT;Private Polytechnic;204;a
Escola Superior de Educação de João de Deus;João de Deus Higher School of Education;PT;Private Polytechnic;172;a
Escola Superior de Educação de Paula Frassinetti;Higher School of Education of Paula Frassinetti;PT;Private Polytechnic;374;a
Escola Superior de Educação Jean Piaget de Almada;Jean Piaget Higher School of Education of Almada;PT;Private Polytechnic;184;a
Escola Superior de Educadores de Infância Maria Ulrich;Maria Ulrich College of Education;PT;Private Polytechnic;98;a
Escola Superior de Enfermagem da Cruz Vermelha Portuguesa de Oliveira de Azeméis;Escola Superior de Enfermagem da Cruz Vermelha Portuguesa de Oliveira de Azeméis;PT;Private Polytechnic;198;a
Escola Superior de Enfermagem de S. José de Cluny;São José de Cluny Higher Education Nursing School;PT;Private Polytechnic;220;a
Escola Superior de Saúde de Santa Maria;Higher School of Health Santa Maria;PT;Private Polytechnic;322;a
Escola Superior de Enfermagem Dr. José Timóteo Montalvão Machado;Dr. José Timóteo Montalvão Machado Higher School of Nursing;PT;Private Polytechnic;184;a
Escola Superior de Enfermagem S. Francisco das Misericórdias;Higher School of Nursing São Francisco das Misericórdias;PT;Private Polytechnic;203;a
Escola Superior de Saúde da Cruz Vermelha Portuguesa - Lisboa;Higher School of Health of The Portuguese Red Cross - Lisbon;PT;Private Polytechnic;564;a
Escola Superior de Saúde do Alcoitão;Higher School of Health of Alcoitão;PT;Private Polytechnic;395;a
Escola Superior de Saúde Egas Moniz;Egas Moniz Higher School of Health;PT;Private Polytechnic;322;a
Escola Superior de Saúde Jean Piaget de Vila Nova de Gaia;Jean Piaget School of Health - Vila Nova de Gaia;PT;Private Polytechnic;204;a
Escola Superior de Saúde Jean Piaget de Viseu;Jean Piaget Higher School of Health of Viseu;PT;Private Polytechnic;162;a
Escola Superior de Saúde Ribeiro Sanches;Ribeiro Sanches Higher School of Health;PT;Private Polytechnic;136;a
Escola Superior de Negócios Atlântico;Atlântico Business School;PT;Private Polytechnic;320;a
CESPU-Instituto Politécnico de Saúde do Norte;Polytechnic Health Higher Institute of the North;PT;Private Polytechnic;932;a
Instituto Português de Administração de Marketing de Lisboa;Portuguese Higher Institute of Marketing Management of Lisbon;PT;Private Polytechnic;250;a
Instituto Português de Administração de Marketing do Porto;Portuguese Higher Institute of Marketing Management of Oporto;PT;Private Polytechnic;835;a
Instituto Superior D. Dinis;D. Dinis Higher Institute;PT;Private Polytechnic;68;a
Instituto Superior de Administração e Gestão;ISAG - European Business School;PT;Private Polytechnic;438;a
Instituto Superior de Administração e Línguas;Higher Institute of Administration and Languages;PT;Private Polytechnic;222;a
Instituto Superior de Ciências da Informação e da Administração;Institute of Information and Management Sciences (IIMS);PT;Private Polytechnic;151;a
ISCE - Instituto Superior de Lisboa e Vale do Tejo;;PT;Private Polytechnic;542;a
Instituto Superior de Ciências Empresariais e do Turismo;Higher Institute of Business and Tourism;PT;Private Polytechnic;360;a
Instituto Superior de Educação e Ciências;Higher Institute of Education and Science;PT;Private Polytechnic;813;a
Instituto Superior de Entre Douro e Vouga;ISVOUGA - Entre Douro e Vouga Higher Institute;PT;Private Polytechnic;394;a
Instituto Superior de Gestão Bancária;ISGB - The Portuguese School of Bank Management;PT;Private Polytechnic;315;a
Instituto Superior de Tecnologias Avançadas de Lisboa;Higher Advanced Technologies Institute of Lisbon;PT;Private Polytechnic;495;a
Instituto Superior Politécnico Gaya;Gaya Politechnic Superior Institute;PT;Private Polytechnic;361;a
IADE Universidade Europea;IADE Universidade Europea;PT;Private University;xr;xr
Universidade de Lisboa;Universidade de Lisboa;PT;Public University;43288;4247
ISLA - Instituto Politécnico de Gestão e Tecnologia;ISLA – Polytechnic Institute of Management and Technology;PT;Private Polytechnic;525;a
Instituto Politécnico da Maia;Polytechnic Institute of Maia;PT;Private Polytechnic;493;a
Universidade Lusíada - Norte;Lusíada University - North;PT;Private University;2122;28
"Universitatea ""1 Decembrie 1918"" din Alba Iulia";"""1 Decembrie 1918"" University of Alba Iulia";RO;University;4241;153
"Universitatea ""Aurel Vlaicu"" din Arad";"""Aurel Vlaicu"" University of Arad";RO;University;m;m
Universitatea din Piteşti;University of Pitesti;RO;University;m;m
"Universitatea ""Vasile Alecsandri"" din Bacău";"""Vasile Alecsandri"" University of Bacau";RO;University;m;m
Universitatea din Oradea - Bihor;University of Oradea;RO;University;m;m
"Universitatea ""Transilvania"" din Brașov";"""Transilvania"" University of Brasov";RO;University;18690;458
Academia Forțelor Aeriene Henri Coandă Brașov;"""Henri Coanda"" Air Force Academy";RO;University;345;a
"Universitatea ""Eftimie Murgu"" din Reșița";"""Eftimie Murgu"" University of Resita";RO;University;m;m
Universitatea Technică din Cluj-Napoca;Technical University of Cluj-Napoca;RO;University;m;m
"Universitatea ""Babeș-Bolyai"" din Cluj-Napoca";"""Babes-Bolyai"" University";RO;University;36883;2120
Universitatea de Științe Agricole și Medicină Veterinară din Cluj-Napoca;University of Agricultural Sciences and Veterinary Medicine of Cluj-Napoca;RO;University;5505;276
"Universitatea de Medicină și Farmacie ""Iuliu Hațieganu""";"""Iuliu Haţieganu"" University of Medicine and Pharmacy of Cluj-Napoca";RO;University;12791;393
Universitatea de Artă și Design Cluj-Napoca;University of Art and Design Cluj-Napoca;RO;University;m;m
Academia de Muzică „Gheorghe Dima” din Cluj-Napoca;"""Gheorghe Dima"" Music Academy from Cluj-Napoca";RO;University;m;m
Universitatea Maritimă din Constanța;Constanta Maritime University;RO;University;4908;23
"Universitatea ""Ovidius"" din Constanța";"""Ovidius"" University of Constanta";RO;University;m;m
"Academia Navală ""Mircea cel Bătrân"" Constanța";"""Mircea Cel Batran"" Naval Academy";RO;University;m;m
"Universitatea ""Valahia"" din Târgovişte";"""Valahia"" University of Targoviste";RO;University;m;m
Universitatea din Craiova;University of Craiova;RO;University;17128;421
Universitatea de Medicină și Farmacie din Craiova;University of Medicine and Pharmacy Craiova;RO;University;m;m
Universitatea „Dunărea de Jos” din Galați;"""Dunarea de Jos"" University of Galati";RO;University;11262;226
"Universitatea ""Constantin Brâncuși"" din Târgu Jiu";"""Constantin Brancusi"" University of Targu Jiu";RO;University;m;m
Universitatea din Petroșani;University of Petrosani;RO;University;m;m
Universitatea Tehnică „Gheorghe Asachi” din Iași;"""Gheorghe Asachi"" Technical University of Iasi";RO;University;m;m
Universitatea „Alexandru Ioan Cuza” din Iași;"""Alexandru Ioan Cuza"" University of Iași";RO;University;m;m
Universitatea de Științe Agricole și Medicină Veterinară „Ion Ionescu de la Brad” din Iași;"""Ion Ionescu de la Brad"" University of Agricultural Sciences and Veterinary Medicine of Iasi";RO;University;m;m
Universitatea de Medicină și Farmacie „Grigore T. Popa” din Iași;"""Grigore T. Popa"" University of Medicine and Pharmacy Iasi";RO;University;m;m
Universitatea Națională de Arte „George Enescu” din Iasi;"""George Enescu"" National University of Arts";RO;University;m;m
"Universitatea ""Petru Maior"" din Târgu Mureș";"""Petru Maior"" University of Targu Mures";RO;University;m;m
Universitatea de Medicină și Farmacie din Târgu Mureș;University of Medicine and Pharmacy of Targu Mures;RO;University;m;m
Universitatea de Arte din Târgu Mureș;University of Arts of Targu Mures;RO;University;m;m
"Universitatea ""Petrol - Gaze"" din Ploiești";"""Petroleum-Gas"" University of Ploiesti";RO;University;6772;89
"Universitatea ""Lucian Blaga"" din Sibiu";"""Lucian Blaga"" University of Sibiu";RO;University;m;m
"Academia Forțelor Terestre ""Nicolae Bălcescu” din Sibiu";"""Nicolae Balcescu"" Land Forces Academy Sibiu";RO;University;m;m
Universitatea „Ștefan cel Mare” din Suceava;"""Stefan cel Mare"" University of Suceava";RO;University;7456;231
"Universitatea ""Politehnica"" Timișoara";"""Politehnica"" University of Timisoara";RO;University;m;m
Universitatea de Vest din Timișoara;West University of Timişoara;RO;University;m;m
Universitatea de Științe Agricole și Medicină Veterinară a Banatului “Regele Mihai I al României” din Timișoara;"The Banat University of Agricultural Sciences and Veterinary Medicine ""King Michael I of Romania"" from Timisoara";RO;University;m;m
"Universitatea de Medicină și Farmacie ""Victor Babeș"" din Timișoara";"""Victor Babes"" University of Medicine and Pharmacy Timisoara";RO;University;m;m
Universitatea Politehnica din București;The Politechnica University of Bucharest;RO;University;m;m
"Universitatea de Arhitectură şi Urbanism ""Ion Mincu"" din Bucuresti";"""Ion Mincu"" University of Architecture and Urbanism";RO;University;m;m
Universitatea Tehnică de Construcții din București;Technical University of Civil Engineering Bucharest;RO;University;m;m
Universitatea din București;University of Bucharest;RO;University;m;m
Universitatea Naţională de Educaţie Fizică şi Sport din Bucureşti;National University of Physical Education and Sport, Bucharest;RO;University;m;m
Universitatea de Științe Agronomice și Medicină Veterinară din București;University of Agronomic Sciences and Veterinary Medicine of Bucharest;RO;University;m;m
Academia de Studii Economice din București;Bucharest University of Economic Studies;RO;University;m;m
Universitatea de Medicină și Farmacie „Carol Davila” din Bucuresti;"University of Medicine and Pharmacy ""CAROL DAVILA"" Bucharest";RO;University;m;m
Universitatea Naţională de Artă Teatrală şi Cinematografică “I.L.Caragiale” din București;"University of Theatre and Film ""I.L. Caragiale"", Bucharest";RO;University;m;m
Universitatea Națională de Arte din București;National University of Arts Bucharest;RO;University;m;m
Universitatea Naţională de Muzică din Bucureşti;National University of Music Bucharest;RO;University;m;m
Școala Națională de Studii Politice și Administrative din București;National University of Political Studies and Public Administration;RO;University;m;m
Academia de Poliție „Alexandru Ioan Cuza” din Bucureşti;"""Alexandru Ioan Cuza"" Police Academy of Bucharest";RO;University;m;m
Academia Tehnică Militară din Bucureşti;"Military Technical Academy ""Ferdinand I""";RO;University;m;m
"Universitatea Naţională de Apărare ""Carol I"" din Bucureşti";"National Defence University ""Carol I""";RO;University;m;m
"Universitatea de Vest ""Vasile Goldiș"" din Arad";"""Vasile Goldis"" Western University of Arad";RO;Private higher education institution;m;m
"Universitatea ""Constantin Brâncoveanu"" din Piteşti";"""Constantin Brancoveanu"" University of Pitesti";RO;Private higher education institution;m;m
"Universitatea ""George Bacovia"" din Bacău";"""George Bacovia"" University from Bacau";RO;Private higher education institution;m;m
"Universitatea ""Bogdan Vodă""din Cluj-Napoka";"""Bogdan-Voda"" University of Cluj Napoca";RO;Private higher education institution;m;m
"Universitatea ""Andrei Șaguna"" din Constanta";"""Andrei Saguna"" University of Constanta";RO;Private higher education institution;m;m
"Universitatea  ""Petre Andrei"" din Iaşi";"""Petre Andrei"" University of Iasi";RO;Private higher education institution;m;m
"Universitatea ""Dimitrie Cantemir"" din Târgu Mureș";"""Dimitrie Cantemir"" University of Targu Mures";RO;Private higher education institution;m;m
Universitatea Româno-Germană din Sibiu;Romanian-German University of Sibiu;RO;Private higher education institution;m;m
"Universitatea Europeană ""Drăgan"" din Lugoj";"""Dragan"" European University of Lugoj";RO;Private higher education institution;m;m
"Universitatea ""Tibiscus"" din Timișoara";"""Tibiscus"" University of Timisoara";RO;Private higher education institution;m;m
Universitatea „Athenaeum” din București;Athenaeum University of Bucharest;RO;Private higher education institution;m;m
"Universitatea ""Nicolae Titulescu"" din București";"""Nicolae Titulescu"" University of Bucharest";RO;Private higher education institution;m;m
"Universitatea ""Artifex"" din București";"""Artifex"" University of Bucharest";RO;Private higher education institution;m;m
"Universitatea Creștină ""Dimitrie Cantemir"" din București";"""Dimitrie Cantemir"" Christian University";RO;Private higher education institution;m;m
Universitatea Ecologică din București;Ecological University of Bucharest;RO;Private higher education institution;m;m
"Universitatea ""Hyperion"" din București";"""Hyperion"" University of Bucharest";RO;Private higher education institution;m;m
"Universitatea ""Titu Maiorescu"" din București";"""Titu Maiorescu"" University";RO;Private higher education institution;m;m
Universitatea Româno-Americană din București;Romanian-American University of Bucharest;RO;Private higher education institution;m;m
"Universitatea ""Spiru Haret"" din București";"""Spiru Haret"" University of Bucharest";RO;Private higher education institution;8841;a
"Universitatea ""Bioterra"" din București";"""Bioterra"" University Bucharest";RO;Private higher education institution;m;m
Universitatea Apollonia din Iași;"""Apollonia"" University of Iasi";RO;Private higher education institution;m;m
"Universitatea Creştină ""Partium"" din Oradea";"""Partium"" Christian University, Oradea";RO;Private higher education institution;m;m
"Universitatea ""DANUBIUS"" din Galați";"""Danubius"" University of Galati";RO;Private higher education institution;m;m
"Academia Naţională de Informaţii ""Mihai Viteazul"" din București";“Mihai Viteazul” National Intelligence Academy;RO;Private higher education institution;m;m
Institutul Teologic Baptist din București;Baptist Theological Institute of Bucharest;RO;Private higher education institution;m;m
Institutul Teologic Penticostal din Bucureşti;Pentecostal Theological Institute, Bucharest;RO;Private higher education institution;m;m
Institutul Teologic Protestant din Cluj-Napoca;Protestant Theological Institute of Cluj Napoca;RO;Private higher education institution;m;m
Universitatea „Emanuel” din Oradea;"""Emanuel"" University of Oradea";RO;Private higher education institution;m;m
Institutul de Administrare a Afacerilor din București;The Institute for Business Administration in Bucharest (ASEBUSS);RO;Private higher education institution;m;m
"Universitatea ""Sapientia""din Cluj-Napoca";Sapientia Hungarian University of Transylvania;RO;Private higher education institution;m;m
"Universitatea ""Agora"" din Oradea";"""Agora"" University of Oradea";RO;Private higher education institution;m;m
"Universitatea ""Adventus"" din Cernica";Adventus University of Cernica;RO;Private higher education institution;m;m
Fundaţia Ştefan Lupaşcu - Institutul De Studii Europene Din Iaşi;Fundaţia Ştefan Lupaşcu - Institutul De Studii Europene Din Iaşi;RO;Private higher education institution;m;m
Institutul Teologic Romano-Catolic Franciscan Din Roman;Institutul Teologic Romano-Catolic Franciscan Din Roman;RO;Private higher education institution;m;m
"Fundaţia ""Academia Comercială"" Din Satu Mare";"Fundaţia ""Academia Comercială"" Din Satu Mare";RO;Private higher education institution;m;m
Pentru Cultură Şi Învăţământ Ioan Slavici - Universitatea Ioan Slavici Din Timişoara;Pentru Cultură Şi Învăţământ Ioan Slavici - Universitatea Ioan Slavici Din Timişoara;RO;Private higher education institution;m;m
"Fundaţia ""Gaudeamus"" - Universitatea ""Tomis"" Din Constanţa";"Fundaţia ""Gaudeamus"" - Universitatea ""Tomis"" Din Constanţa";RO;Private higher education institution;m;m
"Institutul Teologic Creştin După Evanghelie ""Timotheus"" Din Bucureşti";"Institutul Teologic Creştin După Evanghelie ""Timotheus"" Din Bucureşti";RO;Private higher education institution;m;m
Fundaţia Lumina - Instituţii De Învăţământ - Universitatea Europei De Sud Est - Lumina;Fundaţia Lumina - Instituţii De Învăţământ - Universitatea Europei De Sud Est - Lumina;RO;Private higher education institution;m;m
Școala Normală Superioară- București (S.N.S.B.);Școala Normală Superioară- București (S.N.S.B.);RO;Private higher education institution;m;m
Универзитет У Београду;University of Belgrade;RS;State university;95535;6520
Универзитет У Новом Саду;University of Novi Sad;RS;State university;41634;2263
Универзитет У Нишу;University of Niš;RS;State university;19463;1016
Универзитет У Крагујевцу;University of Kragujevac;RS;State university;14971;744
Универзитет уметности у Београду;University of Arts in Belgrade;RS;State university;2174;543
Државни универзитет у Новом Пазару;State University of Novi Pazar;RS;State university;2028;s
Evropski Univerzitet;European University Belgrade;RS;Private university;110;0
Educons Univerzitet;Educons University Sremska Kamenica;RS;Private university;1853;37
Универзитет Мегатренд;Megatrend University Belgrade;RS;Private university;4639;97
Универзитет Метрополитан;Metropolitan University Belgrade;RS;Private university;747;5
Универзитет Сингидунум;Singidunum University;RS;Private university;7092;124
Универзитет Унион — Никола Тесла;Nikola Tesla - Union University Belgrade;RS;Private university;4315;19
Универзитет Привредна академија у Новом Саду;Economics Academy Novi Sad;RS;Private university;3348;40
Алфа БК Универзитет;University Alfa Belgrade;RS;Private university;1146;s
Visoka škola strukovnih studija - Beogradska politehnika;Higher school of Vocational Studies - Belgrade Polytechnic;RS;m;1326;a
Висока техничка школа струковних студија – Ниш;Higher Technical School of Vocational Studies - Nis;RS;m;1364;a
