id,country,Sending City,Source,lat,lng
2103,Philippines,cebu city,University of Southern Philippines Foundation,10.3,123.9
2104,Azerbaijan,baku,AZERBAIJAN STATE PEDAGOGICAL UNIVERSITY,40.3667,49.8352
2105,Viet Nam,ho chi minh city,University of Medicine and Pharmacy at Ho Chi Minh city,10.8167,106.6333
2106,Ukraine,poltava,POLTAVA V.G. KOROLENKO NATIONAL PEDAGOGIKAL UNIVERSITY,49.5744,34.5686
2107,Estonia,"kambja vald, tartumaa",Eesti Lennuakadeemia,,
2108,Estonia,tallinn,TALLINN UNIVERSITY,59.4372,24.745
2109,Estonia,tallinn,EESTI ETTEVÕTLUSKÕRGKOOL MAINOR,59.4372,24.745
2110,Estonia,tallinn,SISEKAITSEAKADEEMIA,59.4372,24.745
2111,Estonia,tartu,Kõrgem Kunstikool Pallas,58.38,26.7225
2112,Estonia,harju maakond tallinn,SIHTASUTUS ESTONIAN BUSINESS SCHOOL,,
2113,Estonia,tallinn,TALLINNA TEHNIKAKORGKOOL,59.4372,24.745
2114,Serbia,belgrade,"University of Arts in Belgrade, Faculty of Applied Arts in Belgrade",44.8167,20.4667
2115,Malaysia,shah alam,"Faculty of Music, Universiti Teknologi MARA",3.0833,101.5333
2116,Albania,durres,UNIVERSITETI ALEKSANDER MOISIU DURRES,41.3167,19.45
2117,Russian Federation,"saint-petersburg, pushkin",Federal State Budgetary Educational Institution of  Higher Education Saint-Petersburg State Agrarian University,,
2118,Thailand,bangkok,Rajamangala University of Technology Phra Nakhon,13.75,100.5167
2119,EL,tripolis,UNIVERSITY OF PELOPONNESE,,
2120,EL,κοζανη,PANEPISTIMIO DYTIKIS MAKEDONIAS,,
2121,EL,komotini,DIMOKRITIO PANEPISTIMIO THRAKIS,41.1167,25.4
2122,EL,ριο-πατρα,PANEPISTIMIO PATRON,,
2123,EL,κερκυρα,IONIAN UNIVERSITY,,
2124,EL,volos,PANEPISTIMIO THESSALIAS,39.3611,22.9425
2125,EL,kavala,DIETHNES PANEPISTIMIO ELLADOS,40.935,24.415
2126,EL,ηρακλειο,ELLINIKO MESOGEIAKO PANEPISTIMIO,,
2127,EL,χανιά,POLYTECHNEIO KRITIS,,
2128,EL,αθηνα,PANEPISTIMIO DYTIKIS ATTIKIS,,
2129,EL,thessaloniki,ARISTOTELIO PANEPISTIMIO THESSALONIKIS,40.6403,22.9356
2130,EL,kallithea athina,PANTEIO PANEPISTIMIO KOINONIKON KAI POLITIKON EPISTIMON,,
2131,EL,athens,Ecclesiastical Academy of Athens,37.9842,23.7281
2132,EL,athens,ETHNIKO KAI KAPODISTRIAKO PANEPISTIMIO ATHINON,37.9842,23.7281
2133,EL,athens,ANOTATI SCHOLI KALON TECHNON,37.9842,23.7281
2134,EL,ioannina,PANEPISTIMIO IOANNINON,39.6636,20.8522
2135,EL,athens,HAROKOPIO UNIVERSITY,37.9842,23.7281
2136,EL,θεσσαλονικη,UNIVERSITY OF MACEDONIA,,
2137,EL,athens,ATHENS UNIVERSITY OF ECONOMICS AND BUSINESS - RESEARCH CENTER,37.9842,23.7281
2138,EL,ηρακλειο αττικης,ANOTATI SCHOLI PEDAGOGIKIS & TECHNOLOGIKIS EKPEDEFSIS,,
2139,EL,vari,Hellenic Army Academy,,
2140,Jordan,karak,MUTAH UNIVERSITY LTD,33.1167,71.0833
2141,Belarus,gomel,"Educational Institution ""Gomel State Medical University""",,
2142,Albania,gjirokastra,"UNIVERSITETI ""EQREM ÇABEJ"" I GJIROKASTRËS",,
2143,China,xi'an,Northwestern Polytechnical University,34.2667,108.9
2144,Japan,wakasato,"Shinshu University, Center for Energy and Environmental Science",,
2145,Uzbekistan,tashkent,Tahskent Institute of textile and Light Industry,41.3,69.2667
2146,Russian Federation,vladivostok,Federal State Budget Educational Institution of Higher Education Vladivostok State University of Economics and Service,43.1167,131.9
2147,Russian Federation,gatchina,"Autonomous Educational Institution of Higher Education of Leningrad Region ""State Institute of Economics, Finance, Law, and Technology""",59.5667,30.1333
2148,Tajikistan,buston,MINING AND METALLURGICAL INSTITUTE OF TAJIKISTAN,,
2149,Russian Federation,moscow,STATE EDUCATION ESTABLISHMENT FOR HIGHER PROFESSIONAL EDUCATION THE MOSCOW STATE INSTITUTE OF ELECTRONICS AND MATHEMATICS (TECHNICAL UNIVERSITY),55.7558,37.6178
2150,Russian Federation,perm,FEDERAL STATE-FUNDED EDUCATION INSTITUTION OF HIGHER PROFESSIONAL EDUCATION PERM NATIONAL RESEARCH POLYTECHNIC UNIVERSITY,58.0139,56.2489
2151,Israel,beer sheva,SAMI SHAMOON COLLEGE OF ENGINEERING(R.A.) FRIENDLY SOCIETY,,
2152,Malaysia,petaling jaya,UTAR EDUCATION FOUNDATION LBG,3.1073,101.6067
2153,"Taiwan, Province of China",chiayi county,WuFeng University,,
2154,Dominican Republic,santo domingo,INSTITUTO TECNOLOGICO DE SANTO DOMINGO - INTEC,18.4764,-69.8933
2155,Malaysia,sintok,UNIVERSITI UTARA MALAYSIA,,
2156,Albania,vlore,"Universiteti ""Ismail Qemali""",40.45,19.4833
2157,Jordan,irbid,Jordan University of Science & Technology,32.5556,35.85
2158,Ukraine,mariupol,MARIUPOLSKYI DERZHAVNYI UNIVERSYTET,47.1306,37.5639
2159,Russian Federation,kazan,KAZANSKIY GOSUDARSTVENNIY ARCHITEKTURNO-STROITELNIY UNIVERSITET,55.7908,49.1144
2160,Spain,las palmas de gran canaria,Escuela de Arte y Superior de Diseño Gran Canaria,,
2161,Spain,granada,ESCUELA SUPERIOR DE DISEÑO Y ARTE DE ANDALUCIA,37.1781,-3.6008
2162,Spain,valencia,Escuela de arte y superior de Diseño de Valencia,10.1667,-68.0
2163,Spain,palma de mallorca,FUNDACIÓ PER ALS ESTUDIS DE MÚSICA I ARTS ESCÈNIQUES DE LES  ILLES BALEARS - ESCOLA SUPERIOR D'ART DRAMÀTIC DE LES ILLES BALEARS,,
2164,Spain,orihuela (alicante),Escuela de Arte y Superior de Diseño de Orihuela,,
2165,Spain,huesca,Escuela Superior de Conservación y Restauración de Bienes Culturales de Aragón,42.1333,-0.4167
2166,Spain,castellón de la plana,"CONSERVATORIO SUPERIOR DE MÚSICA ""SALVADOR SEGUÍ"" DE CASTELLÓN",,
2167,Spain,zaragoza,UNIVERSIDAD DE ZARAGOZA,41.6483,-0.883
2168,Spain,valencia,UNIVERSITAT DE VALENCIA,10.1667,-68.0
2169,Spain,"el ejido, almería",IES FUENTE NUEVA,,
2170,Spain,la coruña,CENTRO DE ESTUDIOS SUPERIORES UNIVERSITARIOS DE GALICIA S.L.,,
2171,Spain,madrid,FUNDACION UNIVERSITARIA SAN PABLO-CEU,40.4167,-3.7167
2172,Spain,valladolid,Universidad Europea Miguel de Cervantes S.A.,41.6528,-4.7236
2173,Spain,murcia,ESCUELA SUPERIOR DE ARTE DRAMÁTICO DE MURCIA,37.9861,-1.1303
2174,Spain,madrid,ESCUELA DE ARTE 10,40.4167,-3.7167
2175,Spain,castellón,ESCOLA D'ART I SUPERIOR DE DISSENY DE CASTELLON,,
2176,Spain,málaga,CONSERVATORIO SUPERIOR DE MUSICA DE MALAGA,,
2177,Spain,oviedo,UNIVERSIDAD DE OVIEDO,43.36,-5.845
2178,Spain,oviedo,"CONSERVATORIO SUPERIOR DE MÚSICA ""EDUARDO MARTÍNEZ TORNER"" DEL PRINCIPADO DE ASTURIAS",43.36,-5.845
2179,Spain,málaga,Escuela de Arte San Telmo,,
2180,Spain,murcia,Escuela Superior de Diseño de la Región de Murcia,37.9861,-1.1303
2181,Spain,valencia,"Universidad Europea de Valencia, S.L.",10.1667,-68.0
2182,Spain,alicante,CONSERVATORIO SUPERIOR DE DANZA DE ALICANTE,38.3453,-0.4831
2183,Spain,barcelona,Formatic Barna SA,41.3825,2.1769
2184,Spain,barcelona,UNIVERSITAT INTERNACIONAL DE CATALUNYA,41.3825,2.1769
2185,Spain,valencia,FUNDACION UNIVERSIDAD CATOLICA DE VALENCIA SAN VICENTE MARTIR,10.1667,-68.0
2186,Spain,badajoz,UNIVERSIDAD DE EXTREMADURA,38.8803,-6.9753
2187,Spain,madrid,UNIVERSIDAD NACIONAL DE EDUCACION A DISTANCIA,40.4167,-3.7167
2188,Spain,valencia,Escuela Superior de Arte Dramático de Valencia,10.1667,-68.0
2189,Spain,barcelona,Fundació Conservatori del Liceu,41.3825,2.1769
2190,Spain,cordoba,UNIVERSIDAD DE CORDOBA,-31.4167,-64.1833
2191,Spain,barcelona,Institut Joan Brossa,41.3825,2.1769
2192,Spain,salamanca,UNIVERSIDAD PONTIFICIA DE SALAMANCA,20.5703,-101.1972
2193,Spain,madrid,REAL ESCUELA SUPERIOR DE ARTE DRAMÁTICO,40.4167,-3.7167
2194,Spain,madrid,Escuela de Arte La Palma,40.4167,-3.7167
2195,Spain,villanueva de gallego zaragoza,FUNDACION UNIVERSIDAD SAN JORGE,,
2196,Spain,sevilla,UNIVERSIDAD DE SEVILLA,37.39,-5.99
2197,Spain,vitoria-gasteiz,ESCUELA DE ARTE Y SUPERIOR DE DISEÑO VITORIA-GASTEIZ,42.85,-2.6833
2198,Spain,burgos,UNIVERSIDAD DE BURGOS,42.35,-3.6822
2199,Spain,barcelona,NOVA EÒLIA S.L.,41.3825,2.1769
2200,Spain,villanueva de la cañada,UNIVERSIDAD ALFONSO X EL SABIO,,
2201,Spain,barcelona,Escola Massana Centre d'Art i Disseny,41.3825,2.1769
2202,Spain,alicante,ESCUELA DE ARTE Y SUPERIOR DE DISEÑO DE ALICANTE/ESCOLA D'ART I SUPERIOR DE DISSENY D'ALACANT,38.3453,-0.4831
2203,Spain,madrid,Escuela Superior de Canto,40.4167,-3.7167
2204,Spain,lleida,UNIVERSIDAD DE LLEIDA,,
2205,Spain,segovia,"ESCUELA DE ARTE Y SUPERIOR DE DISEÑO ""CASA DE LOS PICOS"" DE SEGOVIA",7.0781,-74.7017
2206,Spain,alcoi,Escuela de Arte y Superior de Diseño de Alcoy/Escola d'Art i Superior de Disseny d'Alcoi,,
2207,Spain,barcelona,Fundació Privada Universitat Abat Oliba CEU,41.3825,2.1769
2208,Spain,ciudad real,UNIVERSIDAD DE CASTILLA - LA MANCHA,,
2209,Spain,avilés,Escuela Superior de Arte del Principado de Asturias,,
2210,Spain,pozuelo de alarcon,ESCUELA SUPERIOR DE GESTION COMERCIAL Y MARKETING ESIC,,
2211,Spain,villaviciosa,"UNIVERSIDAD EUROPEA DE MADRID, SAU",43.4833,-5.4333
2212,Spain,málaga,Escuela Superior de Arte Dramático de Málaga,,
2213,Spain,jerez de la frontera,ESCUELA DE ARTE DE JEREZ,36.6817,-6.1378
2214,Spain,granada,"Real Conservatorio Superior de Música ""Victoria Eugenia""",37.1781,-3.6008
2215,Spain,mataro,FUNDACIO TECNOCAMPUS MATARO-MARESME,41.5421,2.4445
2216,Spain,sevilla,UNIVERSIDAD PABLO DE OLAVIDE,37.39,-5.99
2217,Spain,barcelona,Escola Superior de Disseny i d'Arts Plàstiques,41.3825,2.1769
2218,Spain,valencia,"CONSERVATORI SUPERIOR DE MÚSICA ""JOAQUÍN RODRIGO"" DE VALENCIA",10.1667,-68.0
2219,Spain,la orotava,UNIVERSIDAD EUROPEA DE CANARIAS SL,28.3667,-16.5167
2220,Spain,barcelona,Escola Superior de Disseny i d'Art Llotja,41.3825,2.1769
2221,Spain,santa cruz de tenerife,EASD Fernando Estévez,,
2222,Spain,zamora,ESCUELA DE ARTE Y SUPERIOR DE DISEÑO DE ZAMORA,19.9833,-102.2833
2223,Spain,las palmas de gran canaria,UNIVERSIDAD DE LAS PALMAS DE GRAN CANARIA,,
2224,Spain,barcelona,UNIVERSITAT RAMON LLULL FUNDACIO,41.3825,2.1769
2225,Spain,huelva,ESCUELA DE ARTE LEÓN ORTEGA,37.25,-6.95
2226,Spain,palma de mallorca,UNIVERSITAT DE LES ILLES BALEARS,,
2227,Spain,gijón,Escuela Superior de Arte Dramático del Principado de Asturias,,
2228,Spain,barcelona,FUNDACIÓN JESUITAS EDUCACIÓN/FUNDACIÓ JESUÏTES EDUCACIÓ,41.3825,2.1769
2229,Spain,valencia,CEEDCV,10.1667,-68.0
2230,Spain,madrid,ESCUELA SUPERIOR CONSERVACION Y RESTAURACION BIENES CULTURALES,40.4167,-3.7167
2231,Spain,avila,UNIVERSIDAD CATOLICA SANTA TERESA DE JESUS DE AVILA,40.65,-4.6833
2232,Spain,armilla,ESCUELA DISEÑO GRANADA S.L.,37.15,-3.6167
2233,Spain,castellon de la plana,UNIVERSITAT JAUME I DE CASTELLON,39.9831,-0.0331
2234,Spain,barcelona,INSTITUT DEL TEATRE,41.3825,2.1769
2235,Spain,la laguna tenerife,UNIVERSIDAD DE LA LAGUNA,,
2236,Spain,santander,Fundación Universidad Europea del Atlántico,43.4628,-3.805
2237,Spain,logroño,Escuela Superior de Diseño de La Rioja,,
2238,Spain,catarroja,FLORIDA CENTRE DE FORMACION SOCIEDAD COOPERATIVA,39.4028,-0.4044
2239,Spain,elche,UNIVERSIDAD MIGUEL HERNANDEZ DE ELCHE,38.2669,-0.6983
2240,Spain,sant cugat del vallès,Escola d'arts de Sant Cugat del Vallès,,
2241,Spain,tarragona,UNIVERSITAT ROVIRA I VIRGILI,41.1187,1.2453
2242,Spain,bilbao,UNIVERSIDAD DE LA IGLESIA DE DEUSTO ENTIDAD RELIGIOSA,43.2569,-2.9236
2243,Spain,barcelona,Escola Superior de Conservació i Restauració de Béns Culturals de Catalunya,41.3825,2.1769
2244,Spain,valladolid,ESCUELA SUPERIOR DE ARTE DRAMÁTICO DE CASTILLA Y LEÓN,41.6528,-4.7236
2245,Spain,pozuelo de alarcon,FUNDACION UNIVERSIDAD FRANCISCO DE VITORIA,,
2246,Spain,a coruña,conservatorio superior de música da coruña,,
2247,Spain,madrid,FUNDACION UNIVERSITARIA SAN PABLO-CEU - UNIVERSIDAD CEU CARDENAL HERRERA,40.4167,-3.7167
2248,Spain,las palmas de gran canaria,Conservatorio Superior de Música de Canarias,,
2249,Spain,vigo,ESCUELA SUPERIOR DE ARTE DRAMÁTICO,42.2314,-8.7124
2250,Spain,sevilla,Escuela Superior de Arte Dramático de Sevilla,37.39,-5.99
2251,Spain,vic,Institut de Vic,,
2252,Spain,sevilla,Escuela de Arte de Sevilla,37.39,-5.99
2253,Spain,almería,ESCUELA DE ARTE DE ALMERÍA,,
2254,Spain,leioa,UNIVERSIDAD DEL PAIS VASCO/ EUSKAL HERRIKO UNIBERTSITATEA,,
2255,Spain,la rioja,UNIVERSIDAD DE LA RIOJA,-29.4131,-66.8558
2256,Spain,ourense,EASD Antonio Faílde,42.3364,-7.8633
2257,Spain,hoyo de manzanares,UNIVERSITAS NEBRISSENSIS SA,,
2258,Spain,pamplona,UNIVERSIDAD DE NAVARRA,42.8167,-1.65
2259,Spain,tomelloso,"ESCUELA SUPERIOR DE CONSERVACIÓN Y RESTAURACIÓN DE BIENES CULTURALES, DISEÑO Y CERÁMICA DE CASTILLA-LA MANCHA",39.1578,-3.0208
2260,Spain,murcia,FUNDACION UNIVERSITARIA SAN ANTONIO,37.9861,-1.1303
2261,Spain,madrid,ISTITUTO EUROPEO DI DESIGN SL,40.4167,-3.7167
2262,Spain,madrid,UNIVERSIDAD ECLESIASTICA SAN DAMASO,40.4167,-3.7167
2263,Spain,pontevedra,ESCUELA SUPERIOR DE CONSERVACIÓN Y RESTAURACIÓN DE BIENES CULTURALES DE GALICIA / ESCOLA SUPERIOR DE CONSERVACIÓN E RESTAURACIÓN DE BENS CULTURAIS DE GALICIA,42.4333,-8.6333
2264,Spain,lleida,Institut Escola del Treball,,
2265,Spain,barcelona,FUNDACIO PRIVADA PER A L'ESCOLA SUPERIOR DE MUSICA DE CATALUNYA,41.3825,2.1769
2266,Spain,vigo pontevedra,UNIVERSIDAD DE VIGO,,
2267,Spain,valladolid,ESCUELA SUPERIOR DE DISEÑO DE VALALDOLID S.L,41.6528,-4.7236
2268,Spain,jaén,Conservatorio Superior de Música de Jaén,,
2269,Spain,madrid,ESCUELA SUPERIOR DE DISEÑO DE MADRID,40.4167,-3.7167
2270,Spain,madrid,UNIVERSIDAD PONTIFICIA COMILLAS,40.4167,-3.7167
2271,Spain,barcelona,"Escuela Superior de Diseño y Moda, S.L.",41.3825,2.1769
2272,Colombia,bogota,UNIVERSIDAD DISTRITAL FRANCISCO JOSE DE CALDAS,4.6126,-74.0705
2273,Nigeria,ibadan,UNIVERSITY OF IBADAN,7.3964,3.9167
2274,Ukraine,dnipro,DNIPRO UNIVERSITY OF TECHNOLOGY,48.45,34.9833
2275,Nigeria,akure,"Metallurgical and Materials Engineering, FUTA",7.25,5.195
2276,Brazil,rio de janeiro,Universidade do Estado do Rio de Janeiro,-22.9083,-43.1964
2277,Mozambique,beira,UNIVERSIDADE ZAMBEZE,-19.8333,34.85
2278,Uganda,kampala,KYAMBOGO UNIVERSITY,0.3136,32.5811
2279,Equatorial Guinea,malabo,UNIVERSIDAD NACIONAL DE GUINEA ECUATORIAL,3.7521,8.7737
2280,Serbia,novi sad,"UNIVERZITET U NOVOM SADU, AKADEMIJAUMETNOSTI SA POTPUNOM ODGOVORNOSCU,NOVI SAD",45.2644,19.8317
2281,Tunisia,tunis,Université Libre de Tunis,36.8008,10.18
2282,China,shanghai,SHANGHAI INTERNATIONAL STUDIES UNIVERSITY,31.1667,121.4667
2283,Tunisia,cité mahrajène,INAT,,
2284,Peru,arequipa,UNIVERSIDAD CATOLICA DE SANTA MARIA,-16.3988,-71.5369
2285,Togo,lom�,UNIVERSITE DE LOME,,
2286,Cuba,la habana,Universidad de las Ciencias Informáticas,,
2287,Argentina,santa fe,UNIVERSIDAD NACIONAL DEL LITORAL,-31.6333,-60.7
2288,Guatemala,ciudad de guatemala,UNIVERSIDAD DEL VALLE DE GUATEMALA,,
2289,Kyrgyzstan,bishkek,STATE EDUCATIONAL INSTITUTION HIGHER PROFFESSIONAL EDUCATION KYRGYZ-RUSIAN SLAVIC UNIVERSITY,42.8667,74.5667
2290,China,logroño,GUANGDONG UNIVERSITY OF TECHNOLOGY,,
2291,Tunisia,tunis carthage,UNIVERSITY COLLEGE OF AVIATION & TECHNOLOGY,,
2292,Peru,lima,UNIVERSIDAD SAN MARTIN DE PORRES ASOCIACION,-12.05,-77.0333
2293,"Taiwan, Province of China",taichung,National Taichung University of Education,24.15,120.6667
2294,Paraguay,encarnacion,UNIVERSIDAD NACIONAL DE ITAPUA,-27.3333,-55.8667
2295,Argentina,posadas,UNIVERSIDAD NACIONAL DE MISIONES,-27.3667,-55.8969
2296,Belize,belmopan,University of Belize,17.25,-88.7675
2297,Honduras,tegucigalpa,UNIVERSIDAD NACIONAL AUTONOMA DE HONDURAS,14.0942,-87.2067
2298,Argentina,bahia blanca,UNIVERSIDAD NACIONAL DEL SUR,-38.7167,-62.2667
2299,Armenia,gyumri,SHIRAK STATE UNIVERSITY NAMED AFTERNALBANDYAN FOUNDATION,40.7833,43.8333
2300,Belarus,gomel,FRANCISK SKORINA GOMEL STATE UNIVERSITY,,
2301,Mexico,monterrey,Instituto Tecnológico y de Estudios Superiores de Monterrey,25.6667,-100.3
2302,China,beijing,BEIJING LANGUAGE AND CULTURE UNIVERSITY,39.905,116.3914
2303,Brazil,goiania,UNIVERSIDADE FEDERAL DE GOIAS,-16.6806,-49.2564
2304,Peru,lima,PONTIFICIA UNIVERSIDAD CATOLICA DEL PERU,-12.05,-77.0333
2305,Malaysia,kuala lumpur,International Islamic University Malaysia,3.1478,101.6953
2306,"Iran, Islamic Republic of",isfahan,University of Isfahan,,
2307,Russian Federation,krasnodar,KUBAN STATE UNIVERSITY,45.0333,38.9833
2308,Russian Federation,ulan ude,THE FEDERAL STATE EDUCATION INSTITUTION OF HIGHER PROFESSIONAL TRAINING BURYAT STATE ACADEMY OF AGRICULTURE NAMED AFTER V R PHILIPPOV,,
2309,Ukraine,dubliany,lviv national agrarian university,,
2310,"Bolivia, Plurinational State of",santa cruz de la sierra,Universidad Privada Domingo Savio,,
2311,Morocco,beni mellal,UNIVERSITE SULTAN MOULAY SLIMANE,32.3394,-6.3608
2312,China,hangzhou,Zhejiang Conservatory of Music,30.25,120.1675
2313,Kazakhstan,almaty,"Republican state institution ""The Kurmangazy Kazakh National Conservatory""",43.25,76.9
2314,Ukraine,kharkiv,Kharkiv I.P. Kotlyarevsky National University of Arts,50.0,36.2292
2315,Argentina,bernal,UNIVERSIDAD NACIONAL DE QUILMES,-34.7,-58.2833
2316,Nepal,bhaktapur,Nepal Engineering College,27.6722,85.4278
2317,Ghana,cape coast,University of Cape Coast,5.1,-1.25
2318,"Iran, Islamic Republic of",gorgan,Gorgan University of Agricultural Science and Natural resources,36.83,54.48
2319,Chile,santiago,UNIVERSIDAD DIEGO PORTALES,-33.45,-70.6667
2320,United States,jacksonville,University of North Florida,30.3322,-81.6749
2321,Brazil,itajai,FUNDACAO UNIVERSIDADE DO VALE DO ITAJAI,-26.9078,-48.6619
2322,Algeria,alger,UNIVERSITE D'ALGER 2,,
2323,Algeria,oran,Universite Oran2,35.6969,-0.6331
2324,Peru,lima 33,UNIVERSIDAD DE LIMA,,
2325,"Iran, Islamic Republic of",tehran,ALLAMEH TABATABA'I UNIVERSITY,35.7,51.4167
2326,Indonesia,malang,University of Muhammadiyah Malang,-7.98,112.62
2327,Canada,fredericton,UNIVERSITY OF NEW BRUNSWICK,45.9636,-66.6431
2328,Georgia,tbilisi,GEORGIAN AMERICAN UNIVERSITY LLC,41.7225,44.7925
2329,Georgia,tbilisi,SOKHUMI STATE UNIVERSITY,41.7225,44.7925
2330,Georgia,tbilisi,LLC CAUCASIAN INTERNATIONAL UNIVERSITY,41.7225,44.7925
2331,Georgia,tbilisi,Georgian-European Higher Education Institution,41.7225,44.7925
2332,"Congo, The Democratic Republic of the",kinshasa,Université Protestante au Congo,-4.3233,15.3081
2333,"Congo, The Democratic Republic of the",goma,Université Libre des Pays des Grands Lacs,-1.6794,29.2336
2334,Spain,elda,CIPFP VALLE DE ELDA,38.4789,-0.7967
2335,Spain,porriño,IES Ribeira do Louro,,
2336,Spain,pontevedra,IES LUIS SEOANE,42.4333,-8.6333
2337,Spain,alzira,CIPFP Luis Suñer Sanchis,,
2338,Albania,tirana,MARIN BARLETI SHA,41.33,19.82
2339,Armenia,yerevan,NATIONAL POLYTECHNIC UNIVERSITY OF ARMENIA FOUNDATION,40.1814,44.5144
2340,Algeria,setif,UNIVERSITE SETIF 2,36.19,5.41
2341,China,yangling,NORTHWEST A&F UNIVERSITY,,
2342,China,nanjing,Jinling College of Nanjing University,32.05,118.7667
2343,Honduras,tegucigalpa,UNIVERSIDAD PEDAGOGICA NACIONAL FRANCISCO MORAZAN,14.0942,-87.2067
2344,Nicaragua,managua,UNIVERSIDAD DE LA REGIONES AUTONOMAS DE LA COSTA CARIBE NICARAGUENSE ASOCIACION,12.15,-86.2667
2345,Tajikistan,khujand,STATE EDUCATION INSTITUTION OF ECONOMY AND TRADE OF TAJIK STATE UNIVERSITY OF COMMERCE,40.2833,69.6167
2346,Japan,yamaguchi-shi,NATIONAL UNIVERSITY COOPERATION  YAMAGUCHI,,
2347,Ukraine,odessa,ODESSA NATIONAL POLYTECHNIC UNIVERSITY,31.8831,-102.3406
2348,"Bolivia, Plurinational State of",oruro,Universidad Técnica de Oruro,-17.9667,-67.1167
2349,Côte d'Ivoire,abidjan,UNIVERSITE NANGUI ABROGOUA,5.3364,-4.0267
2350,United States,athens,UGA RESEARCH FOUNDATION INC NON PROFIT CORP,37.9842,23.7281
2351,China,beijing,BEIJING JIAOTONG UNIVERSITY,39.905,116.3914
2352,Afghanistan,kandahar,Kandahar University,31.6078,65.7053
2353,Afghanistan,lashkar gah,Bost University,31.5938,64.3716
2354,Afghanistan,kabul,Kabul Medical University,34.5328,69.1658
2355,Armenia,yerevan,YEREVAN STATE MEDICAL UNIVERSITY AFTER MKHITAR HERATSI,40.1814,44.5144
2356,"Palestine, State of",ramallah,AL-QUDS OPEN UNIVERSITY,,
2357,Canada,montreal,CORPORATION DE L ECOLE POLYTECHNIQUE DE MONTREAL ASSOCIATION,45.5089,-73.5617
2358,Argentina,san martin buenos aires,UNIVERSIDAD NACIONAL DE GENERAL SAN MARTIN,,
2359,Pakistan,islamabad,Bahria University,33.6989,73.0369
2360,Cuba,holguin,UNIVERSIDAD DE HOLGUIN,20.8872,-76.2631
2361,"Korea, Republic of",incheon,INCHEON NATIONAL UNIVERSITY,37.4639,126.6486
2362,Pakistan,karachi,Institute of Business Management,24.86,67.01
2363,Ecuador,tena,UNIVERSIDAD REGIONAL AMAZONICA IKIAM,-0.989,-77.8159
2364,Tunisia,tunis,"FACULTY OF SCIENCES OF TUNIS, UNIVERSITY OF TUNIS EL MANAR",36.8008,10.18
2365,"Korea, Republic of",seoul,Sejong University,37.56,126.99
2366,"Korea, Republic of",suwon,SUNGKYUNKWAN UNIVERSITY,37.2858,127.01
2367,Georgia,tbilisi,Geogrian Aviation University,41.7225,44.7925
2368,"Korea, Republic of",seoul,Dongguk University,37.56,126.99
2369,Kazakhstan,almaty,KIMEP UNIVERSITY JSC,43.25,76.9
2370,Jordan,tafila,TAFILA TECHNICAL UNIVERSITY,,
2371,Russian Federation,vladivostok,FAR EASTERN FEDERAL UNIVERSITY,43.1167,131.9
2372,Guatemala,guatemala,USAC2014,,
2373,Ukraine,kiev,BORYS GRINCHENKO KYIV UNIVERSITY,,
2374,Ukraine,kiev,NATIONAL AVIATION UNIVERSITY,,
2375,Russian Federation,moscu,Moscow State Linguistic University,,
2376,Côte d'Ivoire,bouake,UNIVERSITE ALASSANE OUATTARA,7.6833,-5.0331
2377,Ukraine,kiev,Kyiv National Linguistic University,,
2378,Algeria,skikda,université 20 aout 1955 Skikda,36.8667,6.9
2379,Bhutan,thimphu,ROYAL THIMPHU COLLEGE,27.4833,89.6333
2380,Paraguay,encarnación,Universidad Autónoma de Encarnación,,
2381,Serbia,kragujevac,"Faculty of Mechanical Engineering, University of Kragujevac",44.0142,20.9394
2382,Russian Federation,rostov-on-don,FEDERAL STATE-FUNDED EDUCATIONAL INSTITUTION OF HIGHER EDUCATION DON STATE TECHNICAL UNIVERSITY,,
2383,China,"xu zhou, jiangsu ,china",Jiangsu Normal University,,
2384,China,chong qing,Sichuan International Studies University,,
2385,Serbia,novi sad,University of Novi Sad,45.2644,19.8317
2386,Indonesia,surabaya,YAYASAN WIDYA MANDALA,-7.2458,112.7378
2387,Russian Federation,voronezh,"FEDERAL STATE BUDGETARY EDUCATIONAL INSTITUTION OF HIGHER VOCATIONAL EDUCATION ""VORONEZH STATE UNIVERSITY OF ENGINEERING TECHNOLOGIES""",51.6717,39.2106
2388,Colombia,bogotá,Universidad Nacional de Colombia,,
2389,Ecuador,cuenca,Universidad Católica de Cuenca,-2.8974,-79.0045
2390,United States,getafe (madrid),Purdue University,,
2391,"Iran, Islamic Republic of",tabriz,Islamic Art University of Tabriz,38.0833,46.2833
2392,Spain,oviedo,Escuela de Arte de Oviedo,43.36,-5.845
2393,Spain,a coruña,Centro Integrado de Formación Profesional Imaxe e Son,,
2394,Nepal,pokha,POKHARA UNIVERSITY,,
2395,Jordan,yarmo,Yarmouk University,,
2396,Cuba,ciudad de la habana,Universidad de la Habana,,
2397,Bangladesh,"chauhali  ,   sirajganj",Khwaja Yunus Ali University,,
2398,Cameroon,yaoundé,UNIVERSITY OF YAOUNDE 1,,
2399,Tunisia,sfax,Ecole Superieure Polythecnique Internationale Privée de Sfax,34.74,10.76
2400,"Palestine, State of",birzeit,Birzeit University,,
2401,Canada,ontario,Georgian College of Applied Arts and Technology,34.0393,-117.6064
2402,Russian Federation,st petersburg,Saint-Petersburg University of Management Technologies and Economics,,
2403,Iraq,ranya,UNIVERSITY OF RAPARIN,,
2404,Iraq,koya,Koya University,,
2405,Finland,abo,ABO AKADEMI,,
2406,Finland,tampere,TAMPEREEN AMMATTIKORKEAKOULU OY,61.4981,23.7608
2407,Finland,turku,TURUN YLIOPISTO,60.4517,22.27
2408,Finland,kokkola,CENTRIA AMMATTIKORKEAKOULU OY,63.8376,23.132
2409,Finland,taideyliopisto,TAIDEYLIOPISTO,,
2410,Finland,espoo,AALTO KORKEAKOULUSAATIO SR,60.21,24.66
2411,Finland,mariehamn,"Ålands Landskapsregering, Högskolan på Åland",60.0986,19.9444
2412,Finland,lahti,LAB AMMATTIKORKEAKOULU OY,60.9804,25.655
2413,Finland,kajaani,KAJAANIN AMMATTIKORKEAKOULU OY,64.225,27.7333
2414,Finland,kuopio,ITA-SUOMEN YLIOPISTO,62.8925,27.6783
2415,Finland,oulu,OULUN YLIOPISTO,65.0142,25.4719
2416,Finland,tampere,TTY-SAATIO,61.4981,23.7608
2417,Finland,rovaniemi,LAPIN AMMATTIKORKEAKOULU OY,66.5028,25.7285
2418,Finland,vaasa,OY VAASAN AMMATTIKORKEAKOULU - VASAYRKESHOGSKOLA AB,63.1,21.6167
2419,Finland,vasa,AB YRKESHOGSKOLAN VID ABO AKADEMI,,
2420,Finland,helsinki,SUOMEN HUMANISTINEN AMMATTIKORKEAKOULU OY HUMAK,60.1756,24.9342
2421,Finland,lappeenranta,LAPPEENRANNAN-LAHDEN TEKNILLINEN YLIOPISTO LUT,61.0583,28.1861
2422,Finland,rovaniemi,LAPIN YLIOPISTO,66.5028,25.7285
2423,Finland,helsinki,METROPOLIA AMMATTIKORKEAKOULU OY,60.1756,24.9342
2424,Finland,lappeenranta,Saimaan ammattikorkeakoulu Oy,61.0583,28.1861
2425,Finland,helsinki,SVENSKA HANDELSHOGSKOLAN,60.1756,24.9342
2426,Finland,jyvaskyla,JYVASKYLAN AMMATTIKORKEAKOULU,62.2333,25.7333
2427,Finland,oulu,OULUN AMMATTIKORKEAKOULU OY,65.0142,25.4719
2428,Finland,pori,SATAKUNNAN AMMATTIKORKEAKOULU OY,61.4847,21.7972
2429,Finland,joensuu,KARELIA AMMATTIKORKEAKOULU OY,62.6,29.7639
2430,Finland,helsinki,HAAGA-HELIA AMMATTIKORKEAKOULU OY,60.1756,24.9342
2431,Finland,kuopio,SAVONIA-AMMATTIKORKEAKOULU OY,62.8925,27.6783
2432,Finland,vaasa,VAASAN YLIOPISTO,63.1,21.6167
2433,Finland,turku,TURUN AMMATTIKORKEAKOULU OY,60.4517,22.27
2434,Finland,helsinki,YRKESHOGSKOLAN ARCADA AB,60.1756,24.9342
2435,Finland,jyv�skyl�,JYVASKYLAN YLIOPISTO,,
2436,Morocco,rabat,UNIVERSITE MOHAMMED V-SOUISSI,34.0253,-6.8361
2437,Morocco,rabat,Ecole Nationale Supérieure des Mines de Rabat,34.0253,-6.8361
2438,Brazil,novo hamburgo,ASSOCIACAO PRO ENSINO SUPERIOR EM NOVO HAMBURGO,-29.6778,-51.1308
2439,United States,lubbock,TEXAS TECH UNIVERSITY,33.5659,-101.8878
2440,India,chandigarh,CHITKARA UNIVERSITY,30.7353,76.7911
2441,Kenya,kisumu,MASENO UNIVERSITY,-0.1,34.75
2442,Uganda,kampala,International Health Sciences University,0.3136,32.5811
2443,Kazakhstan,almaty,T. Zhurgenov Kazakh national academy of arts,43.25,76.9
2444,Chile,san carlos de apoquindo,UNIVERSIDAD DEL DESARROLLO,,
2445,Chile,santiago,FUNDACION INSTITUTO PROFESIONAL DUOC UC,-33.45,-70.6667
2446,Zambia,lusaka,Lusaka Schools of Nursing and Midwifery,-15.4167,28.2833
2447,Zambia,livingstone,Livingstone Schools of Nursing and Midwifery,-17.85,25.8667
2448,Israel,jerusalem,THE DAVID YELLIN ACADEMIC COLLEGE OF EDUCATION (A.R.),31.7833,35.2167
2449,Bangladesh,dhaka,Jahangirnagar University,23.7289,90.3944
2450,Russian Federation,ekaterinburg,UrFU,,
2451,XK,pristina,KOLEGJI HEIMERER SHPK,42.6667,21.1667
