,country,Sending City,Source,lat,lng,admin_name,id
0,China,beijing,China Foreign Affairs University,39.905,116.3914,Beijing,0
1,Austria,wien,FACHHOCHSCHULE DES BFI WIEN GESELLSCHAFT M.B.H.,48.2083,16.3731,Wien,1
2,Russian Federation,rostov on don,SOUTHERN FEDERAL UNIVERSITY,,,,2
3,Russian Federation,saint petersburg,FEDERAL STATE BUDGET EDUCATIONAL INSTITUTION OF HIGHER EDUCATION SAINTPETERSBURG STATE ECONOMIC UNIVERSITY,59.95,30.3167,Sankt-Peterburg,3
4,Austria,wien,UNIVERSITAT WIEN,48.2083,16.3731,Wien,4
5,Cuba,plaza,UNIVERSIDAD DE LA HABANA,,,,5
6,Ethiopia,addis ababa,ADDIS ABABA UNIVERSITY,9.0272,38.7369,Ādīs Ābeba,6
7,Serbia,novi sad,UNIVERZITET U NOVOM SADU,45.2644,19.8317,Novi Sad,7
8,Israel,jerusalem,THE HEBREW UNIVERSITY OF JERUSALEM,31.7833,35.2167,Southern,8
9,Serbia,beograd,UNIVERZITET U BEOGRADU,,,,9
10,Ukraine,lviv,IVAN FRANKO NATIONAL UNIVERSITY OF LVIV,49.8419,24.0315,L’vivs’ka Oblast’,10
11,Austria,wien,Fachhochschule Technikum Wien,48.2083,16.3731,Wien,11
12,Thailand,bangkok,Suan Dusit University,13.75,100.5167,Krung Thep Maha Nakhon,12
13,Austria,wien,UNIVERSITAET FUER BODENKULTUR WIEN,48.2083,16.3731,Wien,13
14,Kyrgyzstan,bishkek,Kyrgyz National Agrarian University named after K.I.Skryabin,42.8667,74.5667,Bishkek,14
15,Israel,haifa,GORDON ACADEMIC COLLEGE OF EDUCATION,32.8,34.9833,Haifa,15
16,Austria,graz,FH JOANNEUM GESELLSCHAFT MBH,47.0749,15.4409,Steiermark,16
17,Uganda,entebbe,NKUMBA UNIVERSITY,0.05,32.46,Wakiso,17
18,United States,detroit,Michelle Cade,42.3834,-83.1024,Michigan,18
19,Israel,rishon le zion,College of Management Academic Studies,,,,19
20,Mexico,monterrey nuevo leon,INSTITUTO TECNOLOGICO Y DE ESTUDIOS SUPERIORES DE MONTERREY,,,,20
21,Georgia,tbilisi,L.E.P.L Apollon Kutateladze Tbilisi State Academy of Art,41.7225,44.7925,Tbilisi,21
22,Georgia,tbilisi,Caucasus University Ltd,41.7225,44.7925,Tbilisi,22
23,Costa Rica,cartago,INSTITUTO TECNOLOGICO DE COSTA RICA,9.8667,-83.9167,Cartago,23
25,Thailand,"hat yai, songkhla",Prince of Songkla University,,,,24
26,"Taiwan, Province of China",kaohsiung,National Kaohsiung First University of Science and Technology,22.6167,120.3,Kaohsiung,25
27,nan,windhoek,NAMIBIA UNIVERSITY OF SCIENCE AND TECHNOLOGY,-22.57,17.0836,Khomas,26
28,Austria,graz,UNIVERSITAET GRAZ,47.0749,15.4409,Steiermark,27
29,Brazil,niteroi,UNIVERSIDADE FEDERAL FLUMINENSE,-22.8833,-43.1036,Rio de Janeiro,28
30,Russian Federation,tomsk,Tomsk State University,56.4886,84.9522,Tomskaya Oblast’,29
31,Bosnia and Herzegovina,sarajevo,UNIVERZITET U SARAJEVU,43.8667,18.4167,"Bosnia and Herzegovina, Federation of",30
32,Cuba,santa clara,"Universidad Central ""Marta Abreu"" de Las Villas",22.4067,-79.9531,Villa Clara,31
35,Trinidad and Tobago,kingston,THE UNIVERSITY OF THE WEST INDIES U WI*,17.9714,-76.7931,Kingston,32
44,United States,montclair,Montclair State University,34.0714,-117.698,California,33
47,Chile,santiago,UNIVERSIDAD DE CHILE,-33.45,-70.6667,Región Metropolitana,34
57,Israel,haifa,UNIVERSITY OF HAIFA,32.8,34.9833,Haifa,35
58,Ukraine,chernivtsi,CHERNIVTSI NATIONAL UNIVERSITY YURIY FEDKOVYCH,48.2908,25.9344,Chernivets’ka Oblast’,36
59,Austria,innsbruck,UNIVERSITAET INNSBRUCK,47.2683,11.3933,Tirol,37
60,Israel,beit berl,BEIT BERL COLLEGE,,,,38
61,Israel,beer sheva,BEN-GURION UNIVERSITY OF THE NEGEV,,,,39
62,Georgia,tbilisi,ILIA STATE UNIVERSITY,41.7225,44.7925,Tbilisi,40
63,Austria,wien,PADAGOGISCHE HOCHSCHULE WIEN,48.2083,16.3731,Wien,41
64,United States,albuquerque new mexico,UNIVERSITY OF NEW MEXICO - UNMG,,,,42
65,Austria,wien,WIRTSCHAFTSUNIVERSITAT WIEN,48.2083,16.3731,Wien,43
66,Thailand,bangkok,THAMMASAT UNIVERSITY,13.75,100.5167,Krung Thep Maha Nakhon,44
67,Ukraine,kyiv,VADYM HETMAN KYIV NATIONAL ECONOMIC UNIVERSITY,50.45,30.5236,"Kyyiv, Misto",45
68,United States,champaign,THE BOARD OF TRUSTEES OF THE UNIVERSITY OF ILLINOIS,40.1144,-88.2735,Illinois,46
69,Austria,salzburg,PARIS-LODRON-UNIVERSITAT SALZBURG,47.7972,13.0477,Salzburg,47
70,Russian Federation,moscow,Pushkin State Russian Language Institute,55.7558,37.6178,Moskva,48
72,Georgia,batumi,SHOTA RUSTAVELI STATE UNIVERSITY,41.6458,41.6417,Ajaria,49
73,Kyrgyzstan,osh,Osh Technological University,40.5333,72.7833,Osh,50
74,Uzbekistan,tashkent,TOSHKENT IRRIGASIYA VA QISHLOQ XO JALIGINI MEXANIZATSIYALASH MUHANDISLARI INSTITUTI,41.3,69.2667,Toshkent,51
75,Montenegro,podgorica,"Faculty of Political Science, University of Montenegro",42.4397,19.2661,Podgorica,52
76,Montenegro,podgorica,University of Donja Gorica,42.4397,19.2661,Podgorica,53
77,Australia,melbourne,UNIVERSITY OF MELBOURNE,-37.8136,144.9631,Victoria,54
79,New Zealand,wellington,THE RESEARCH TRUST OF VICTORIA UNIVERSITY OF WELLINGTON,-41.2889,174.7772,Wellington,55
85,"Iran, Islamic Republic of",tehran,UNIVERSITY OF TEHRAN,35.7,51.4167,Tehrān,56
86,Austria,leoben,MONTANUNIVERSITAT LEOBEN,47.3817,15.0972,Steiermark,57
87,Ukraine,dnipropetrovsk,NATIONAL MINING UNIVERSITY,,,,58
88,Malaysia,shah alam,"Universiti Teknologi MARA, Shah Alam",3.0833,101.5333,Selangor,59
89,Israel,ramat gan,BAR ILAN UNIVERSITY,32.07,34.8235,Tel Aviv,60
90,Hong Kong,hong kong,The Hong Kong Institute of Education,22.305,114.185,,61
91,Israel,holon,HOLON INSTITUTE OF TECHNOLOGY,32.0167,34.7667,Tel Aviv,62
92,Austria,innsbruck,MCI MANAGEMENT CENTER INNSBRUCK INTERNATIONALE HOCHSCHULE GMBH,47.2683,11.3933,Tirol,63
93,"Taiwan, Province of China",tainan,NATIONAL CHENG KUNG UNIVERSITY,22.9833,120.1833,Tainan,64
94,United States,saint augustine,Flagler College,,,,65
95,Belgium,louvain-la-neuve,UNIVERSITE CATHOLIQUE DE LOUVAIN,50.6696,4.6112,Wallonia,66
96,Belgium,brussels,Haute Ecole Libre de Bruxelles - Ilya Prigogine,50.8333,4.3333,Brussels-Capital Region,67
97,"Moldova, Republic of",chisinau,UNIVERSITATEA DE STAT DIN MOLDOVA,47.0228,28.8353,Chişinău,68
98,Russian Federation,moscow,M.V. LOMONOSOV MOSCOW STATE UNIVERSITY,55.7558,37.6178,Moskva,69
100,Russian Federation,st petersburg,STATE HIGHER PROFESSIONAL EDUCATION INSTITUTION HERZEN STATE PEDAGOGICAL UNIVERSITY OF RUSSIA,,,,70
101,Georgia,tbilisi,IVANE JAVAKHISHVILI TBILISI STATE UNIVERSITY,41.7225,44.7925,Tbilisi,71
102,Armenia,yerevan,YEREVAN BRUSOV STATE UNIVERSITY OFLANGUAGES AND SOCIAL SCIENCES,40.1814,44.5144,Yerevan,72
103,Indonesia,jakarta ciputat,Syarif Hidayatullah State Islamic University Jakarta,,,,73
104,Armenia,yerevan,Yerevan State University,40.1814,44.5144,Yerevan,74
105,Peru,lima,Pontificia Universidad Catolica del Peru,-12.05,-77.0333,Lima,75
107,Morocco,rabat instituts,Institut Supérieur de l'Information et de la Communication (ISIC),,,,76
108,Belgium,liege,UNIVERSITE DE LIEGE,50.6397,5.5706,Wallonia,77
109,Hong Kong,kowloon,Hong Kong Polytechnic University,,,,78
110,Canada,montreal,UNIVERSITE DU QUEBEC A MONTREAL*UQAM,45.5089,-73.5617,Quebec,79
111,Russian Federation,orel,"Federal State Budget Educational Institution of Higher Education ""Orel state university named after I.S. Turgenev""",52.9686,36.0694,Orlovskaya Oblast’,80
112,Rwanda,kigali,University of Rwanda,-1.9536,30.0606,Kigali,81
113,Morocco,oujda,UNIVERSITE MOHAMMED PREMIER 1 - UMP,,,,82
114,Morocco,marrakech,UNIVERSITE CADI AYYAD,31.6295,-7.9811,Marrakech-Safi,83
115,Cameroon,yaounde,UNIVERSITE DE YAOUNDE I,3.8578,11.5181,Centre,84
116,Burkina Faso,ouagadougou 03,UNIVERSITE DE OUAGADOUGOU,,,,85
117,Kazakhstan,astana,JOINT STOCK COMPANY KAZGUU UNIVERSITY,,,,86
118,Russian Federation,st petersburg,"SAINT PETERSBURG NATIONAL RESEARCH UNIVERSITY OF INFORMATION TECHNOLOGIES, MECHANICS AND OPTICS",,,,87
119,Tunisia,sfax,ECOLE NATIONALE D'INGENIEURS DE SFAX,34.74,10.76,Sfax,88
120,"Congo, The Democratic Republic of the",kinshasa,UNIVERSITE DE KINSHASA,-4.3233,15.3081,Kinshasa,89
121,Tunisia,soliman,CENTRE DE RECHERCHES ET DES TECHNOLOGIES DES EAUX,,,,90
122,Morocco,rabat,HEM,34.0253,-6.8361,Rabat-Salé-Kénitra,91
124,Russian Federation,moskva,FEDERAL STATE AUTONOMOUS EDUCATIONAL INSTITUTION FOR HIGHER EDUCATION NATIONAL RESEARCH UNIVERSITY HIGHER SCHOOL OF ECONOMICS,,,,92
125,Russian Federation,tomsk,State Educational Institution of Higher Professional Education TOMSK STATE UNIVERSITY,56.4886,84.9522,Tomskaya Oblast’,93
126,Tunisia,sousse,Université de Sousse,35.8333,10.6333,Sousse,94
127,Thailand,bangkok,SRINAKHARINWIROT UNIVERSITY,13.75,100.5167,Krung Thep Maha Nakhon,95
128,Viet Nam,can tho city,CAN THO UNIVERSITY,,,,96
129,Kazakhstan,almaty,KAZAKH-BRITISH TECHNICAL UNIVERSITY JSC,43.25,76.9,Almaty,97
130,"Taiwan, Province of China",taoyuan city,CHANG GUNG University,,,,98
131,Tunisia,sfax,SFAX UNIVERSITY,34.74,10.76,Sfax,99
132,Tunisia,tunis,Université de Tunis,36.8008,10.18,Tunis,100
133,Belgium,brussel,VRIJE UNIVERSITEIT BRUSSEL,,,,101
134,Morocco,rabat,UNIVERSITE MOHAMMED V DE RABAT,34.0253,-6.8361,Rabat-Salé-Kénitra,102
136,China,chengdu,SICHUAN UNIVERSITY,30.66,104.0633,Sichuan,103
137,China,beijing,Renmin University of China,39.905,116.3914,Beijing,104
138,Morocco,sala al jadida,UNIVERSITE INTERNATIONALE DE RABAT,,,,105
139,China,xian,XIDIAN UNIVERSITY - XDU,,,,106
140,Belgium,gent,UNIVERSITEIT GENT,51.0536,3.7253,Flanders,107
141,Russian Federation,st.petersburg,St.Petersburg Polytechnic University,,,,108
142,Canada,manitoba,UNIVERSITY OF MANITOBA,,,,109
143,Belgium,brussel,ODISEE,,,,110
144,Bosnia and Herzegovina,zenica,JAVNA USTANOVA UNIVERZITET U ZENICI UNIVERSITAS STUDIORUM ZENICAENSIS,44.2039,17.9078,"Bosnia and Herzegovina, Federation of",111
145,Jordan,amman,GERMAN JORDANIAN UNIVERSITY,31.95,35.9333,Al ‘Āşimah,112
146,Morocco,fes,UNIVERSITE SIDI MOHAMMED BEN ABDELLAH,34.0433,-5.0033,Fès-Meknès,113
147,Bhutan,thimphu,ROYAL UNIVERSITY OF BHUTAN,27.4833,89.6333,Thimphu,114
148,Brazil,belo horizonte minas gerais,UNIVERSIDADE FEDERAL DE MINAS GERAIS,,,,115
149,Brazil,florianopolis,UNIVERSIDADE FEDERAL DE SANTA CATARINA.,-27.5933,-48.553,Santa Catarina,116
150,Belgium,hasselt,UNIVERSITEIT HASSELT,50.9304,5.3383,Flanders,117
152,Jordan,amman,Princess Sumaya University for Technology,31.95,35.9333,Al ‘Āşimah,118
153,Armenia,yerevan,ARMENIAN STATE UNIVERSITY OF ECONOMICS,40.1814,44.5144,Yerevan,119
154,Ukraine,drohobych,Drohobytskyy derzhavnyy pedahohichnyy universytet imeni Ivana Franka,49.35,23.5,L’vivs’ka Oblast’,120
155,Belgium,kortrijk,KATHOLIEKE HOGESCHOOL VIVES ZUID,,,,121
156,Viet Nam,can tho,Can Tho University of Medicine and Pharmacy,10.0333,105.7833,Cần Thơ,122
157,Ukraine,kyiv,NATIONAL DRAGOMANOV PEDAGOGICAL UNIVERSITY OF UKRAINE,50.45,30.5236,"Kyyiv, Misto",123
158,Belgium,geel,THOMAS MORE KEMPEN VZW,,,,124
159,Russian Federation,volgograd,VOLGOGRADSKIY GOSUDARSTVENNIY TEKHNICHESKIY UNIVERSITET,48.7086,44.5147,Volgogradskaya Oblast’,125
160,Ukraine,lviv,HIGHER EDUCATIONAL ESTABLISHMENT UKRAINIAN CATHOLIC UNIVERSITY,49.8419,24.0315,L’vivs’ka Oblast’,126
161,Israel,jerusalem,The David Yellin Academic College of Education,31.7833,35.2167,Southern,127
162,Suriname,paramaribo,ANTON DE KOM UNIVERSITEIT VAN SURINAME,5.8667,-55.1667,Paramaribo,128
163,Viet Nam,hanoi,Hanoi National University of Education,21.0245,105.8412,Hà Nội,129
164,Bulgaria,blagoevgrad,SOUTH-WEST UNIVERSITY NEOFIT RILSKI,42.0119,23.0897,Blagoevgrad,130
165,Albania,elbasan,UNIVERSITET ALEKSANDER XHUVANI ELBASAN,41.1125,20.0822,Elbasan,131
166,Albania,tirana,Tirana University,41.33,19.82,Tiranë,132
167,Egypt,cairo,THE AMERICAN UNIVERSITY IN CAIRO,30.0561,31.2394,Al Qāhirah,133
170,Egypt,qena,SOUTH VALLEY UNIVERSITY,,,,134
171,Bulgaria,sofia,SOFIISKI UNIVERSITET SVETI KLIMENT OHRIDSKI,42.6979,23.3217,Sofia-Grad,135
172,China,guangzhou,GUANGDONG UNIVERSITY OF FOREIGN STUDIES,23.1288,113.259,Guangdong,136
173,Bosnia and Herzegovina,sarajevo,University of Sarajevo,43.8667,18.4167,"Bosnia and Herzegovina, Federation of",137
174,Ukraine,kyiv,Kyiv National University of Trade and Economics,50.45,30.5236,"Kyyiv, Misto",138
175,Ukraine,kyiv,TARAS SHEVCHENKO NATIONAL UNIVERSITY OF KYIV,50.45,30.5236,"Kyyiv, Misto",139
176,Serbia,nis,UNIVERZITET U NISU,43.3192,21.8961,Niš,140
177,Brazil,sao paulo sp,UNIVERSIDADE DE SAO PAULO,,,,141
178,Australia,callaghan,University of Newcastle,,,,142
179,Cyprus,nicosia,University of Nicosia,35.1725,33.365,Lefkosía,143
181,Serbia,novi sad,"Faculty of Philosophy, University of Novi Sad",45.2644,19.8317,Novi Sad,144
182,Czechia,praha,METROPOLITNI UNIVERZITA PRAHA OPS,,,,145
183,Czechia,brno sever,MENDELOVA UNIVERZITA V BRNE,,,,146
184,Czechia,praha,Česká zemědělská univerzita v Praze,,,,147
185,Czechia,zlin,UNIVERZITA TOMASE BATI VE ZLINE,49.2331,17.6669,Zlínský Kraj,148
186,Israel,jerusalem,BEZALEL ACADEMY OF ARTS AND DESIGN,31.7833,35.2167,Southern,149
187,Jordan,amman,UNIVERSITY OF JORDAN,31.95,35.9333,Al ‘Āşimah,150
188,Czechia,ostrava,OSTRAVSKA UNIVERZITA,49.8356,18.2925,Moravskoslezský Kraj,151
189,Russian Federation,moscow,A.N. Kosygin Russian State University (Technologies. Design. Art),55.7558,37.6178,Moskva,152
191,Russian Federation,moscow,RUSSIAN STATE SOCIAL UNIVERSITY,55.7558,37.6178,Moskva,153
193,Azerbaijan,baku,BAKU SLAVIC UNIVERSITY,40.3667,49.8352,Bakı,154
194,Czechia,pilsen,ZAPADOCESKA UNIVERZITA V PLZNI,,,,155
195,Russian Federation,volgograd,STATE EDUCATION INSTITUTION OF HIGHER PROFESSIONAL EDUCATION VOLGOGRAD STATE UNIVERSITY,48.7086,44.5147,Volgogradskaya Oblast’,156
196,Czechia,pardubice,UNIVERZITA PARDUBICE,50.0386,15.7792,Pardubický Kraj,157
197,Belarus,minsk,BELARUSIAN STATE UNIVERSITY,53.9022,27.5618,Minsk,158
198,India,ahmedabad,Rai University,23.03,72.58,Gujarāt,159
199,Belarus,mogilev,Educational Establishment Mogilev State A.Kuleshov University,,,,160
200,India,guwahati,Indian Institute of Technology Guwahati,26.1667,91.7667,Assam,161
201,Czechia,opava,SLEZSKA UNIVERZITA V OPAVE,49.9381,17.9044,Moravskoslezský Kraj,162
202,India,"durg, chhattisgarh","BHILAI INSTITUTE OF TECHNOLOGY, DURG",,,,163
203,Uzbekistan,tashkent,The National University of Uzbekistan named after Mirzo Ulugbek,41.3,69.2667,Toshkent,164
204,Thailand,bangsue,KING MONGKUT'S UNIVERSITY OF TECHNOLOGY NORTH BANGKOK,,,,165
205,Japan,matsumoto,THE NATIONAL UNIVERSITY CORPORATION SHINSHU UNIVERSITY,,,,166
206,India,new delhi,Indian Institute of Technology Delhi,28.7,77.2,Delhi,167
207,"Iran, Islamic Republic of",tehran,"Science &Research Branch , Islamic Azad University",35.7,51.4167,Tehrān,168
208,"Korea, Republic of","bucheon-si, gyeonggi-do",The Catholic University of Korea,,,,169
209,Czechia,mlada boleslav ii,SKODA AUTO VYSOKA SKOLA OPS,,,,170
210,Bosnia and Herzegovina,kiseljak,"Visoka skola ""CEPS - Centar za poslovne studije"" Kiseljak",,,,171
211,India,manipal,MANIPAL ACADEMY OF HIGHER EDUCATION,,,,172
212,Czechia,hradec kralove,UNIVERZITA HRADEC KRALOVE,50.2092,15.8319,Královéhradecký Kraj,173
213,Russian Federation,moscow,MOSCOW STATE PEDAGOGICAL UNIVERSITY,55.7558,37.6178,Moskva,174
215,"Korea, Republic of",seoul,SANGMYUNG UNIVERSITY,37.56,126.99,Seoul,175
216,Kenya,nairobi,UNIVERSITY OF NAIROBI,-1.2864,36.8172,Nairobi City,176
217,Nicaragua,león,"Universidad Nacional Autónoma de Nicaragua, León",,,,177
218,Czechia,brno stred,Masarykova univerzita,,,,178
219,Serbia,novi sad,University of Novi Sad Faculty of Sciences,45.2644,19.8317,Novi Sad,179
220,Russian Federation,moscow,RUDN University,55.7558,37.6178,Moskva,180
222,"Taiwan, Province of China",taipei,NATIONAL CHENGCHI UNIVERSITY,25.0478,121.5319,Taipei,181
223,Egypt,cairo,HELWAN UNIVERSITY,30.0561,31.2394,Al Qāhirah,182
226,Azerbaijan,baku,Baku State University,40.3667,49.8352,Bakı,183
227,Sri Lanka,peradeniya,UNIVERSITRY OF PERADENIYA,,,,184
228,Serbia,niš,University of Nis,,,,185
229,Lebanon,damour,MODERN UNIVERSITY FOR BUSINESS AND SCIENCE,,,,186
230,Bosnia and Herzegovina,tuzla,University of Tuzla,44.5381,18.6761,"Bosnia and Herzegovina, Federation of",187
232,Lebanon,beirut,UNIVERSITE SAINT-JOSEPH,33.8869,35.5131,Beyrouth,188
233,Canada,saskatoon,UNIVERSITY OF SASKATCHEWAN,52.1333,-106.6833,Saskatchewan,189
234,Viet Nam,ho chi minh,Truong Dai hoc Bach Khoa-Dai hoc Quoc Gia Tp Ho Chi Minh,,,,190
235,Lebanon,beirut,LEBANESE AMERICAN UNIVERSITY,33.8869,35.5131,Beyrouth,191
236,Viet Nam,hanoi,TRUONG DAI HOC BACH KHOA HANOI - HANOI UNIVERSITY OF SCIENCE AND TECHNOLOGY HUST,21.0245,105.8412,Hà Nội,192
237,Dominican Republic,santo domingo,INSTITUTO TECNOLOGICO DE SANTO DOMINGO,18.4764,-69.8933,Ozama,193
242,Belarus,minsk,HIGHER EDUCATIONAL ESTABLISHMENT OF THE FEDERATION OF TRADE UNIONS OF BELARUS INTERNATIONAL UNIVERSITY MITSO,53.9022,27.5618,Minsk,194
243,Serbia,belgrade,University of Belgrade Faculty of Law,44.8167,20.4667,Beograd,195
245,Sri Lanka,kelaniya,UNIVERSITY OF KELANIYA,,,,196
246,XK,pristina,Aga Xhite,42.6667,21.1667,Prishtinë,197
247,Kenya,nairobi,KENYATTA UNIVERSITY,-1.2864,36.8172,Nairobi City,198
248,Cuba,bayamo,Universidad de Granma,20.3817,-76.6428,Granma,199
249,Czechia,praha 1,UNIVERZITA KARLOVA,,,,200
250,"Moldova, Republic of",chisinau,Academy of Economic Studies of Moldova,47.0228,28.8353,Chişinău,201
251,"Moldova, Republic of",tiraspol,Pridnestrovian Shevchenko State University,46.85,29.6333,Stînga Nistrului,202
252,Armenia,yerevan,STATE EDUCATIONAL ESTABLISHMENT OF HIGHER PROFESSIONAL EDUCATION RUSSIAN-ARMENIAN (SLAVONIC) UNIVERSITY,40.1814,44.5144,Yerevan,203
253,Azerbaijan,baku,Qarb Universiteti,40.3667,49.8352,Bakı,204
254,Russian Federation,kazan,FEDERAL STATE AUTONOMOUS EDUCATIONAL INSTITUTION OF HIGHER LEARNING KAZAN VOLGA REGION FEDERAL UNIVERSITY,55.7908,49.1144,Tatarstan,205
255,China,beijing,CHINA AGRICULTURAL UNIVERSITY,39.905,116.3914,Beijing,206
256,Germany,munchen,HOCHSCHULE FUR DEN OFFENTLICHEN DIENST IN BAYERN,,,,207
257,Germany,gera,SRH Hochschule für Gesundheit GmbH,50.8782,12.0824,Thuringia,208
258,Germany,saarbrücken,Hochschule der Bildenden Künste Saar,,,,209
259,Germany,koethen,HOCHSCHULE ANHALT,,,,210
260,Germany,berlin,Evangelische Hochschule Berlin,52.5167,13.3833,Berlin,211
265,Germany,ludwigsburg,PADAGOGISCHE HOCHSCHULE LUDWIGSBURG,48.8975,9.1919,Baden-Württemberg,212
266,Germany,karlsruhe,Karlshochschule gemeinnützige GmbH,49.0167,8.4,Baden-Württemberg,213
267,Germany,aalen,HOCHSCHULE AALEN - TECHNIK UND WIRTSCHAFT,48.8372,10.0936,Baden-Württemberg,214
268,Germany,neuendettelsau,Augustana-Hochschule,49.2667,10.7667,Bavaria,215
269,Germany,goettingen,GESELLSCHAFT FÜR PRAXISBEZOGENE FORSCHUNG UND WISSENSCHAFTLICHE LEHRE GGMBH,,,,216
270,Germany,alfter,Alanus Hochschule gGmbH,50.7356,7.0092,North Rhine-Westphalia,217
271,Germany,hamburg,University of Applied Sciences Europe GmbH,53.55,10.0,Hamburg,218
273,Germany,berlin,Berlin International University of Applied Sciences,52.5167,13.3833,Berlin,219
278,Germany,mannheim,HOCHSCHULE DER WIRTSCHAFT FUR MANAGEMENT,49.4878,8.4661,Baden-Württemberg,220
279,India,gandhinagar,Dhirubhai Ambani Institute of Information and Communication Technology,,,,221
280,Germany,flensburg,EUROPA-UNIVERSITAT FLENSBURG,54.7819,9.4367,Schleswig-Holstein,222
281,Russian Federation,penza,PENZA STATE UNIVERSITY,53.2,45.0,Penzenskaya Oblast’,223
282,Germany,rottenburg am neckar,HOCHSCHULE FUER FORSTWIRTSCHAFT ROTTENBURG,,,,224
283,Paraguay,asuncion,UNIVERSIDAD SAN CARLOS,-25.3,-57.6333,Asunción,225
284,Germany,wiesbaden,Hochschule RheinMain,50.0825,8.24,Hesse,226
285,China,fuzhou,FUZHOU UNIVERSITY,26.0769,119.2917,Fujian,227
287,United States,river falls,University of Wisconsin-River Falls,44.861,-92.6248,Wisconsin,228
288,Germany,bonn,RHEINISCHE FRIEDRICH-WILHELMS-UNIVERSITAT BONN,50.7339,7.0997,North Rhine-Westphalia,229
289,Thailand,nakhon pathom,"Institute for Population and Social Research, Mahidol University",13.8194,100.0581,Nakhon Pathom,230
290,Germany,hannover,HOCHSCHULE HANNOVER,52.3744,9.7386,Lower Saxony,231
291,Japan,hirosima,Hiroshima City University,,,,232
292,Russian Federation,novocherkassk,FEDERAL STATE BUDGETARY EDUCATIONAL INSTITUTION OF HIGHER EDUCATION M.I. PLATOV SOUTH-RUSSIAN STATE POLITECHNIC UNIVERSITY NPI,47.4222,40.0939,Rostovskaya Oblast’,233
293,Ukraine,kharkiv,"PRIVATE HIGHER EDUCATIONAL INSTITUTION KHARKIV UNIVERSITY OF HUMANITIES ""PEOPLE'S UKRAINIAN ACADEMY""",50.0,36.2292,Kharkivs’ka Oblast’,234
294,Russian Federation,saint-petersburg,SAINT PETERSBURG STATE UNIVERSITY,,,,235
295,Russian Federation,samara,FGBOU VO SAMARSKIJ GOSUDARSTVENNYJ TECHNICHESKIJ UNIVERSITET,53.1833,50.1167,Samarskaya Oblast’,236
296,Israel,tel aviv,TEL AVIV UNIVERSITY,,,,237
297,Kenya,nyeri,Dedan Kimathi University of Technology,-0.4167,36.95,Nyeri,238
298,Germany,berlin,HOCHSCHULE FUR WIRTSCHAFT UND RECHT BERLIN,52.5167,13.3833,Berlin,239
303,United States,san diego,SAN DIEGO STATE UNIVERSITY FOUNDATION,32.8312,-117.1225,California,240
306,Germany,bochum,RUHR-UNIVERSITAET BOCHUM,51.4833,7.2167,North Rhine-Westphalia,241
307,Germany,bielefeld,FACHHOCHSCHULE BIELEFELD,52.0167,8.5333,North Rhine-Westphalia,242
308,Germany,vallendar,WHU  Otto Beisheim School of Management,50.4003,7.6172,Rhineland-Palatinate,243
309,Serbia,novi pazar,DRZAVNI UNIVERZITET U NOVOM PAZARU,43.15,20.5167,Novi Pazar,244
311,Armenia,yerevan,ARMENIAN NATIONAL AGRARIAN UNIVERSITY,40.1814,44.5144,Yerevan,245
312,Kyrgyzstan,naryn,S. NAAMATOV NARYN STATE UNIVERSITY,41.4333,76.0,Naryn,246
313,Ukraine,sumy,SUMY NATIONAL AGRARIAN UNIVERSITY,50.9068,34.7992,Sums’ka Oblast’,247
314,Russian Federation,belgorod,FEDERAL STATE BUDGETARY AUTONOMOUS EDUCATIONAL INSITUTION OF HIGHER EDUCATION BELGOROD STATE AGRICULTURAL UNIVERSITY NAMED AFTER V GORIN,50.6,36.6,Belgorodskaya Oblast’,248
315,Azerbaijan,ganja city,AZERBAIJAN STATE AGRICULTURE UNIVERSITY,,,,249
316,Bosnia and Herzegovina,banja luka,UNIVERZITET U BANJOJ LUCI,44.7667,17.1833,"Srpska, Republika",250
317,Kyrgyzstan,bishkek,INSTITUTION OF HIGHER EDUCATION KYRGYZ NATIONAL AGRARIAN UNIVERSITY NAMED AFTER K.I. SKRYABIN,42.8667,74.5667,Bishkek,251
318,Russian Federation,krasnodar,Kuban State Agrarian University,45.0333,38.9833,Krasnodarskiy Kray,252
319,Russian Federation,voronezh,Voronezh State Agrarian University,51.6717,39.2106,Voronezhskaya Oblast’,253
320,Russian Federation,knyaginino,Nizhny Novgorod State Engineering and Economic University,55.8167,45.0333,Nizhegorodskaya Oblast’,254
321,Russian Federation,saratov,THE FEDERAL STATE BUDGETARY EDUCATIONAL INSTITUTION OF HIGHER EDUCATION THE SARATOV STATE AGRARIAN UNIVERSITY NAMED AFTER N.I. VAVILOV,51.5333,46.0,Saratovskaya Oblast’,255
322,Uzbekistan,tashkent,TROSHKENT DAVLAT AGRAR UNIVERSITETI,41.3,69.2667,Toshkent,256
323,Kazakhstan,astana,SEIFULLIN KAZAKH AGRO TECHNICAL UNIVERSITY,,,,257
324,Germany,heilbronn,Duale Hochschule Baden-Württemberg Heilbronn,49.1404,9.218,Baden-Württemberg,258
325,Germany,cottbus,BRANDENBURGISCHE TECHNISCHE UNIVERSITAT COTTBUS-SENFTENBERG,51.7606,14.3342,Brandenburg,259
326,Azerbaijan,baku,AZERBAYCAN TEXNIKI UNIVERSITETI,40.3667,49.8352,Bakı,260
327,Thailand,muang district,MAE FAH LUANG UNIVERSITY,,,,261
328,Germany,ludwigsburg,PAEDAGOGISCHE HOCHSCHULE LUDWIGSBURG,48.8975,9.1919,Baden-Württemberg,262
329,United States,charlotte,UNIVERSITY OF NORTH CAROLINA AT CHARLOTTE,35.208,-80.8304,North Carolina,263
331,India,new delhi,BHARAT RATNA DR B R AMBEDKAR VISHWAVIDYALAYA,28.7,77.2,Delhi,264
332,Ukraine,kyiv,KYIV NATIONAL UNIVERSITY OF CONSTRUCTION AND ARCHITECTURE,50.45,30.5236,"Kyyiv, Misto",265
333,Ukraine,ternopil,TERNOPIL NATIONAL ECONOMIC UNIVERSITY,49.5667,25.6,Ternopil’s’ka Oblast’,266
334,Ukraine,zaporizhzhya,ZAPORIZHZHYA NATIONAL TECHNICAL UNIVERSITY,,,,267
335,XK,pristina,UNIVERSITETI I PRISHTINES,42.6667,21.1667,Prishtinë,268
336,Germany,giessen,JUSTUS-LIEBIG-UNIVERSITAET GIESSEN,50.5833,8.6667,Hesse,269
337,Uganda,kampala,MAKERERE UNIVERSITY,0.3136,32.5811,Kampala,270
338,XK,prishtina,University of Prishtina,,,,271
339,Uzbekistan,samarkand,SAMARQAND VETERINARIYA MEDITSINASIINSTITUTI,39.6542,66.9597,Samarqand,272
340,Ukraine,kyiv,NATIONAL UNIVERSITY OF KYIV-MOHYLA ACADEMY,50.45,30.5236,"Kyyiv, Misto",273
341,Colombia,medellin,Universidad de Antioquia,6.2447,-75.5748,Antioquia,274
343,Albania,tirana,U.E.T. SHPK,41.33,19.82,Tiranë,275
344,Bosnia and Herzegovina,ilidza sarajevo,INTERNACIONALNI UNIVERZITET U SARAJEVU,,,,276
345,Tunisia,tunis,UNIVERSITE DE TUNIS EL MANAR,36.8008,10.18,Tunis,277
346,XK,ferizaj,KOLEGJI UNIVERSUM O.P,42.3667,21.1667,Ferizaj,278
347,Germany,wuerzburg,University of Applied Sciences Wuerzburg-Schweinfurt,,,,279
348,Ukraine,kharkiv,NATIONAL TECHNICAL UNIVERSITY KHARKIV POLYTECHNICAL INSTITUTE,50.0,36.2292,Kharkivs’ka Oblast’,280
349,Germany,ilmenau,TECHNISCHE UNIVERSITAET ILMENAU,50.6872,10.9142,Thuringia,281
350,Malaysia,johor bahru,UNIVERSITI TEKNOLOGI MALAYSIA,1.4556,103.7611,Johor,282
351,Russian Federation,saint petersburg,SAINT PETERSBURG ELECTROTECHNICAL UNIVERSITY LETI,59.95,30.3167,Sankt-Peterburg,283
352,United States,orlando,UNIVERSITY OF CENTRAL FLORIDA,28.4772,-81.3369,Florida,284
353,Russian Federation,kazan,KAZAN NATIONAL RESEARCH TECHNICAL UNIVERSITY NAMED AFTER A.N. TUPOLEV-KAI FEDERAL STATE BUDGET-FUNDED EDUCATIONAL INST HIGH PROF EDUC KNRTU,55.7908,49.1144,Tatarstan,285
354,Germany,wuerzburg,JULIUS-MAXIMILIANS-UNIVERSITAT WURZBURG,,,,286
355,Bosnia and Herzegovina,sarajevo,"Faculty of Philosophy, University of Sarajevo",43.8667,18.4167,"Bosnia and Herzegovina, Federation of",287
356,India,400005,TATA INSTITUTE OF FUNDAMENTAL RESEARCH*TIFR,,,,288
357,"Palestine, State of",bethlehem,BETHLEHEM UNIVERSITY,40.6266,-75.3679,Pennsylvania,289
360,China,nanjing,NANJING UNIVERSITY,32.05,118.7667,Jiangsu,290
361,Germany,tuebingen,EBERHARD KARLS UNIVERSITAET TUEBINGEN,,,,291
362,United States,"berkeley, ca","University of California, Berkeley",,,,292
363,Chile,santiago,PONTIFICIA UNIVERSIDAD CATOLICA DE CHILE,-33.45,-70.6667,Región Metropolitana,293
373,United States,flagstaff,Arizona Board of Regents for and on behalf of Northern Arizona University,35.1872,-111.6195,Arizona,294
374,Chile,santiago,UNIVERSIDAD ALBERTO HURTADO,-33.45,-70.6667,Región Metropolitana,295
