,country,Sending City,Source,lat,lng,admin_name,id
4224,Italy,macerata,ACCADEMIA DI BELLE ARTI - MACERATA,43.3003,13.4533,Marche,2942
4225,Italy,faenza,Istituto Superiore per le Industrie Artistiche Faenza,44.2856,11.8833,Emilia-Romagna,2943
4226,Italy,bolzano,LIBERA UNIVERSITA DI BOLZANO,46.5,11.35,Trentino-Alto Adige,2944
4227,Italy,roma,International Campus Srl,26.4166,-99.006,Texas,2945
4229,Italy,palermo,CONSERVATORIO STATALE DI MUSICA A. SCARLATTI PALERMO,2.8883,-75.4339,Huila,2946
4232,Italy,ferrara,UNIVERSITA DEGLI STUDI DI FERRARA,44.8353,11.6199,Emilia-Romagna,2947
4233,Italy,camerino,UNIVERSITA DEGLI STUDI DI CAMERINO,43.1333,13.0667,Marche,2948
4234,Italy,l'aquila,CONSERVATORIO DI MUSICA ALFREDO CASELLA,42.354,13.392,Abruzzo,2949
4235,Italy,salerno,Conservatorio di Musica Giuseppe Martucci Salerno,40.6806,14.7597,Campania,2950
4236,Italy,verona,"Conservatorio Statale di Musica ""E. F. Dall'Abaco""",45.4386,10.9928,Veneto,2951
4240,Italy,venezia,Fine Arts Academy of Venice,,,,2952
4241,Italy,palermo,Accademia di Belle Arti di Palermo,2.8883,-75.4339,Huila,2953
4244,Italy,siena,Siena Jazz - Accademia Nazionale del Jazz,43.3183,11.3314,Tuscany,2954
4245,Italy,bergamo,ACCADEMIA DI BELLE ARTI GIACOMO CARRARA,45.695,9.67,Lombardy,2955
4246,Italy,milano,NUOVA ACCADEMIA SRL,,,,2956
4247,Italy,reggio calabria,Accademia di Belle Arti Reggio Calabria,,,,2957
4248,Italy,cesena,"CONSERVATORIO STATALE DI MUSICA ""BRUNO MADERNA""",44.1333,12.2333,Emilia-Romagna,2958
4249,Italy,livorno,ISSM P. Mascagni,43.55,10.3167,Tuscany,2959
4250,Italy,castellanza,UNIVERSITA' CARLO CATTANEO - LIUC,45.6167,8.9,Lombardy,2960
4251,Italy,l aquila,UNIVERSITA DEGLI STUDI DELL'AQUILA,,,,2961
4252,Italy,lecce,ACCADEMIA DI BELLE ARTI DI LECCE,40.352,18.1691,Puglia,2962
4253,Italy,rome,"CONSERVATORIO DI MUSICA ""SANTA CECILIA""",41.8931,12.4828,Lazio,2963
4256,Italy,roma,LUISS LIBERA UNIVERSITA INTERNAZIONALE DEGLI STUDI SOCIALI GUIDO CARLI,26.4166,-99.006,Texas,2964
4258,Italy,como,Conservatorio di Como,45.8103,9.0861,Lombardy,2965
4259,Italy,fisciano sa,UNIVERSITA DEGLI STUDI DI SALERNO,,,,2966
4260,Italy,napoli,UNIVERSITA TELEMATICA PEGASO,,,,2967
4261,Italy,milano,UNIVERSITA VITA-SALUTE SAN RAFFAELE,,,,2968
4262,Italy,perugia,Mediazione Linguista Perugia Srl,43.1121,12.3888,Umbria,2969
4263,Italy,viterbo,UNIVERSITA DEGLI STUDI DELLA TUSCIA,42.4186,12.1042,Lazio,2970
4264,Italy,catania,Accademia Abadir (ente gestore R.AR.A. SRL),37.5027,15.0873,Sicilia,2971
4265,Italy,caserta,UNIVERSITA DEGLI STUDI DELLA CAMPANIA LUIGI VANVITELLI,41.0667,14.3333,Campania,2972
4266,Italy,pisa,UNIVERSITA DI PISA,43.7167,10.4,Tuscany,2973
4267,Italy,milano,UNIVERSITA DEGLI STUDI DI MILANO,,,,2974
4268,Italy,foggia,"CONSERVATORIO STATALE DI MUSICA ""UMBERTO GIORDANO""",41.4584,15.5519,Puglia,2975
4269,Italy,foggia,UNIVERSITA DEGLI STUDI DI FOGGIA,41.4584,15.5519,Puglia,2976
4270,Italy,roma,UNIVERSITA DEGLI STUDI ROMA TRE,26.4166,-99.006,Texas,2977
4272,Italy,carrara,ACCADEMIA DI BELLE ARTI DI CARRARA,44.0833,10.1,Tuscany,2978
4273,Italy,napoli,UNIVERSITA DEGLI STUDI SUOR ORSOLA BENINCASA,,,,2979
4274,Italy,frosinone,"Conservatorio di Musica ""L. Refice""",41.6333,13.35,Lazio,2980
4275,Italy,bologna,Conservatorio di Musica G.B.Martini,44.4939,11.3428,Emilia-Romagna,2981
4276,Italy,bologna,ACCADEMIA DI BELLE ARTI DI BOLOGNA,44.4939,11.3428,Emilia-Romagna,2982
4277,Italy,roma,Università Telematica Universitas Mercatorum,26.4166,-99.006,Texas,2983
4279,Italy,fiesole,EUROPEAN UNIVERSITY INSTITUTE,43.8,11.3,Tuscany,2984
4280,Italy,florence,Accademia di Belle Arti di Firenze,43.7714,11.2542,Tuscany,2985
4288,Italy,l'aquila,ACCADEMIA DI BELLE ARTI L'AQUILA,42.354,13.392,Abruzzo,2986
4289,Italy,bari,"Conservatorio di Musica ""Niccolò Piccinni"" - Bari",41.1253,16.8667,Puglia,2987
4290,Italy,padova,MAPI SRL,45.4064,11.8778,Veneto,2988
4291,Italy,milan,UNIVERSITA COMMERCIALE LUIGI BOCCONI,45.4669,9.19,Lombardy,2989
4294,Italy,roma,Istituto Superiore per le Industrie Artistiche - I.S.I.A.,26.4166,-99.006,Texas,2990
4296,Italy,florence,Istituto Superiore per le Industrie Artistiche,43.7714,11.2542,Tuscany,2991
4304,Italy,parma,CONSERVATORIO DI MUSICA ARRIGO BOITO,44.8015,10.328,Emilia-Romagna,2992
4308,Italy,macerata,UNIVERSITA DEGLI STUDI DI MACERATA,43.3003,13.4533,Marche,2993
4309,Italy,brescia,Vincenzo Foppa Società Cooperativa Sociale ONLUS,45.5389,10.2203,Lombardy,2994
4310,Italy,vicenza,"CONSERVATORIO DI MUSICA ""ARRIGO PEDROLLO"" DI VICENZA",45.55,11.55,Veneto,2995
4311,Italy,trapani,"Conservatorio di Musica di Stato ""Antonio Scontrino"" - Trapani",38.0175,12.515,Sicilia,2996
4312,Italy,misano adriatico,Fondazione Unicampus San Pellegrino,43.9667,12.7,Emilia-Romagna,2997
4313,Italy,reggio calabria,UNIVERSITA' PER STRANIERI DANTE ALIGHIERI,,,,2998
4314,Italy,trento,UNIVERSITA DEGLI STUDI DI TRENTO,46.0667,11.1167,Trentino-Alto Adige,2999
4316,Italy,catania,UNIVERSITA DEGLI STUDI DI CATANIA,37.5027,15.0873,Sicilia,3000
4317,Italy,vibo valentia,"CONSERVATORIO DI MUSICA ""F.TORREFRANCA"" VIBO VALENTIA",38.6753,16.0959,Calabria,3001
4318,Italy,bari,UNIVERSITA DEGLI STUDI DI BARI ALDO MORO,41.1253,16.8667,Puglia,3002
4319,Italy,rome,Saint Louis Music Center Srl,41.8931,12.4828,Lazio,3003
4322,Italy,monopoli,"Conservatorio di Musica ""Nino Rota""",40.95,17.3,Puglia,3004
4323,Italy,aosta,UNIVERSITA DELLA VALLE D'AOSTA,45.7372,7.3206,Valle d’Aosta,3005
4324,Italy,padova,Conservatorio Statale di Musica C. Pollini -Padova,45.4064,11.8778,Veneto,3006
4325,Italy,napoli,UNIVERSITA DEGLI STUDI DI NAPOLI FEDERICO II,,,,3007
4326,Italy,firenze,UNIVERSITA DEGLI STUDI DI FIRENZE,,,,3008
4327,Italy,verona,UNIVERSITA DEGLI STUDI DI VERONA,45.4386,10.9928,Veneto,3009
4331,Italy,roma,UNIVERSITA DEGLI STUDI GUGLIELMO MARCONI - TELEMATICA,26.4166,-99.006,Texas,3010
4333,Italy,reggio calabria,UNIVERSITA DEGLI STUDI MEDITERRANEA DI REGGIO CALABRIA,,,,3011
4334,Italy,arcavacata di rende,UNIVERSITA DELLA CALABRIA,,,,3012
4335,Italy,catanzaro,Accademia di Belle Arti di Catanzaro,38.91,16.5875,Calabria,3013
4336,Italy,milano,ACCADEMIA DI BELLE ARTI DI BRERA,,,,3014
4337,Italy,potenza,UNIVERSITA DEGLI STUDI DELLA BASILICATA,40.6333,15.8,Basilicata,3015
4338,Italy,milano,LIBERA UNIVERSITA DI LINGUE E COMUNICAZIONE,,,,3016
4339,Italy,bari,Accademia di Belle Arti di Bari,41.1253,16.8667,Puglia,3017
4340,Italy,urbino,Universita' degli Studi di Urbino Carlo Bo,43.7252,12.6372,Marche,3018
4341,Italy,perugia,"Fondazione Accademia di Belle Arti ""P. Vannucci""",43.1121,12.3888,Umbria,3019
4342,Italy,benevento,UNIVERSITA DEGLI STUDI DEL SANNIO,41.1256,14.7811,Campania,3020
4343,Italy,castelfranco veneto,CONSERVATORIO STATALE DI MUSICA A.STEFFANI,45.6667,11.9333,Veneto,3021
4344,Italy,trento,"Conservatorio di musica ""F.A. Bonporti"" di Trento",46.0667,11.1167,Trentino-Alto Adige,3022
4346,Italy,milano,IED Istituto Europeo di Design S.p.A.,,,,3023
4347,Italy,catanzaro,UNIVERSITA DEGLI STUDI MAGNA GRAECIA DI CATANZARO,38.91,16.5875,Calabria,3024
4348,Italy,adria (ro),Conservatorio di Adria,,,,3025
4349,Italy,cremona,Istituto Superiore di Studi Musicali 'Claudio Monteverdi',45.1333,10.0333,Lombardy,3026
4350,Italy,napoli,UNIVERSITA DEGLI STUDI DI NAPOLI PARTHENOPE,,,,3027
4351,Italy,catania,Accademia  Belle Arti di Catania,37.5027,15.0873,Sicilia,3028
4352,Italy,udine,UNIVERSITA DEGLI STUDI DI UDINE,46.0667,13.2333,Friuli-Venezia Giulia,3029
4353,Italy,perugia,UNIVERSITA DEGLI STUDI DI PERUGIA,43.1121,12.3888,Umbria,3030
4354,Italy,caltanissetta,"Istituto Superiore di Studi Musicali ""V. Bellini "" di Caltanissetta",37.4915,14.0624,Sicilia,3031
4355,Italy,latina,Conservatorio di Musica di Latina - Ottorino Respighi,41.4676,12.9037,Lazio,3032
4356,Italy,verona,FONDAZIONE ACCADEMIA DI BELLE ARTI DI VERONA,45.4386,10.9928,Veneto,3033
4360,Italy,potenza,"Conservatorio di musica ""Gesualdo da Venosa""",40.6333,15.8,Basilicata,3034
4361,Italy,milano,POLITECNICO DI MILANO,,,,3035
4362,Italy,milano,UNIVERSITA CATTOLICA DEL SACRO CUORE,,,,3036
4363,Italy,benevento,Università degli studi Giustino Fortunato,41.1256,14.7811,Campania,3037
4364,Italy,sassari,"Conservatorio Statale di Musica ""L. Canepa""",40.7267,8.5592,Sardegna,3038
4365,Italy,napoli,ACCADEMIA DI BELLE ARTI DI NAPOLI,,,,3039
4366,Italy,alessandria,"Conservatorio di Musica ""A. Vivaldi""",44.9133,8.62,Piedmont,3040
4367,Italy,siena,UNIVERSITA PER STRANIERI DI SIENA,43.3183,11.3314,Tuscany,3041
4368,Italy,trieste,UNIVERSITA DEGLI STUDI DI TRIESTE,45.6503,13.7703,Friuli-Venezia Giulia,3042
4369,Italy,naples,UNIVERSITA DEGLI STUDI DI NAPOLI L'ORIENTALE,40.8333,14.25,Campania,3043
4371,Italy,teramo,"Istituto Statale Superiore di Studi Musicali e Coreutici ""G. Braga""",42.6589,13.7039,Abruzzo,3044
4372,Italy,roma,"Università degli Studi di Roma ""Unitelma Sapienza""",26.4166,-99.006,Texas,3045
4374,Italy,pavia,UNIVERSITA DEGLI STUDI DI PAVIA,10.775,122.5417,Iloilo,3046
4376,Italy,milano,UNIVERSITA' DEGLI STUDI DI MILANO-BICOCCA,,,,3047
4377,Italy,novara,Conservatorio Statale di Musica Guido Cantelli,45.45,8.6167,Piedmont,3048
4378,Italy,roma,UNIVERSITA TELEMATICA INTERNAZIONALE-UNINETTUNO,26.4166,-99.006,Texas,3049
4380,Italy,napoli,IUM Academy School,,,,3050
4381,Italy,roma,Rome University of Fine Arts,26.4166,-99.006,Texas,3051
4383,Italy,torino,Accademia Albertina delle Belle Arti,,,,3052
4384,Italy,pavia,"ISTITUTO SUPERIORE DI STUDI MUSICALI ""FRANCO VITTADINI""",10.775,122.5417,Iloilo,3053
4386,Italy,roma,UNIVERSITA DEGLI STUDI NICCOLO CUSANO TELEMATICA ROMA,26.4166,-99.006,Texas,3054
4388,Italy,fermo,"CONSERVATORIO STATALE DI MUSICA ""G.B. PERGOLESI"" - FERMO",43.1604,13.7181,Marche,3055
4389,Italy,castellanza,Scuola Superiore per Mediatori Linguistici Carolina Albasio,45.6167,8.9,Lombardy,3056
4390,Italy,novedrate co,UNIVERSITA TELEMATICA E-CAMPUS,,,,3057
4391,Italy,rome,SSML Gregorio VII,41.8931,12.4828,Lazio,3058
4394,Italy,roma,LINK CAMPUS UNIVERSITY,26.4166,-99.006,Texas,3059
4396,Italy,casamassima (ba),LUM Giuseppe Degennaro,,,,3060
4397,Italy,roma,UNIVERSITA DEGLI STUDI INTERNAZIONALI DI ROMA,26.4166,-99.006,Texas,3061
4399,Italy,enna,UNIVERSITA DEGLI STUDI DI ENNA KORE,37.5667,14.2667,Sicilia,3062
4400,Italy,padova,Scuola Superiore per Mediatori Linguistici CIELS,45.4064,11.8778,Veneto,3063
4401,Italy,parma,UNIVERSITA DEGLI STUDI DI PARMA,44.8015,10.328,Emilia-Romagna,3064
4405,Italy,brescia,UNIVERSITA DEGLI STUDI DI BRESCIA,45.5389,10.2203,Lombardy,3065
4406,Italy,milano,SSML di Mantova,,,,3066
4407,Italy,roma,UNIVERSITA CAMPUS BIO MEDICO DI ROMA,26.4166,-99.006,Texas,3067
4409,Italy,cassino,UNIVERSITA DEGLI STUDI DI CASSINO E DEL LAZIO MERIDIONALE,41.4917,13.8333,Lazio,3068
4410,Italy,chieti,UNIVERSITA DEGLI STUDI GABRIELE D'ANNUNZIO DI CHIETI-PESCARA,42.3511,14.1674,Abruzzo,3069
4411,United States,miami,FLORIDA INTERNATIONAL UNIVERSITY,25.7839,-80.2102,Florida,3070
4413,"Moldova, Republic of",chisinau,INSTITUTIA DE INVATAMINT INSTITUTUL INTERNATIONAL DE MANAGEMENT IMI-NOVA,47.0228,28.8353,Chişinău,3071
4414,Ukraine,chernivtsi,Higher State Educational Establishment of Ukraine ''Bukovinian State Medical University'',48.2908,25.9344,Chernivets’ka Oblast’,3072
4415,Syrian Arab Republic,damascus,Yarmouk Private University,33.5131,36.2919,Dimashq,3073
4418,Uzbekistan,tashkent,TOSHKENT AXBOROT TEXNOLOGIYALARI UNIVERSITETI,41.3,69.2667,Toshkent,3074
4419,Uzbekistan,tashkent,TOSHKENT PEDIATRIYA TIBBIYOT INSTITUTI,41.3,69.2667,Toshkent,3075
4420,Albania,tirane,Aldent shpk,,,,3076
4421,Russian Federation,novosibirsk,NOVOSIBIRSK STATE PEDAGOGICAL UNIVERSITY,55.0333,82.9167,Novosibirskaya Oblast’,3077
4422,China,xi an,XI'AN UNIVERSITY OF ARCHITECTURE AND TECHNOLOGY,,,,3078
4423,Azerbaijan,baku,AZERBAIJAN ARCHITECTURE AND CONSTRUCTION UNIVERSITY,40.3667,49.8352,Bakı,3079
4424,Russian Federation,moscow,Moscow institute of architecture (state academy) MARKHI,55.7558,37.6178,Moskva,3080
4426,Hong Kong,n.t.,The Chinese University of Hong Kong,,,,3081
4427,Argentina,ciudad autonoma buenos aires,FUNDACION UNIVERSIDAD DE BELGRANO DR AVELINO PORTO,,,,3082
4428,Japan,fuchu,Tokyo University of Foreign Studies,35.6689,139.4778,Tōkyō,3083
4429,Japan,kyoto,Ritsumeikan University,35.0111,135.7669,Kyōto,3084
4430,Japan,sendai,NATIONAL UNIVERSITY CORPORATION TOHOKU UNIVERSITY,38.2683,140.8694,Miyagi,3085
4431,Algeria,annaba,UNIVERSITE D'ANNABA,36.9,7.7667,Annaba,3086
4432,Algeria,batna,université Batna 2,35.55,6.1667,Batna,3087
4433,"Moldova, Republic of",chisinau,"Academy of Music, Theatre and Fine Arts",47.0228,28.8353,Chişinău,3088
4434,China,chongqing,Chongqing University of Arts and Sciences,29.5628,106.5528,Chongqing,3089
4435,Russian Federation,astrakhan,Astrakhan State University,46.3333,48.0167,Astrakhanskaya Oblast’,3090
4437,Ethiopia,bahir dar,BAHIR DAR UNIVERSITY,11.585,37.39,Āmara,3091
4438,Canada,ottawa,University of Ottawa,45.4247,-75.695,Ontario,3092
4442,Mongolia,ulaanbaatar,NATIONAL UNIVERSITY OF MONGOLIA,47.9203,106.9172,Ulaanbaatar,3093
4443,Japan,nagasaki-shi,"NATIONAL UNIVERSITY CORPORATION, NAGASAKI UNIVERSITY",,,,3094
4444,Ukraine,mykolayiv,Petro Mohyla Black Sea National University,,,,3095
4445,China,suzhou jiangsu,Soochow University,,,,3096
4446,Russian Federation,moscow,The Maxim Gorky Literary Institute,55.7558,37.6178,Moskva,3097
4448,Russian Federation,khimki moskva,NON-STATE EDUCATIONAL INSTITUTION OF HIGHER VOCATIONAL EDUCATION RUSSIAN INTERNATIONAL ACADEMY FOR TOURISM,,,,3098
4449,"Taiwan, Province of China",taipei,University of Taipei,25.0478,121.5319,Taipei,3099
4450,Albania,tirana,SHOQATA SHOQERIA EKONOMIKE E SHQIPERISE,41.33,19.82,Tiranë,3100
4451,Italy,ribera (ag),"Istituto Superiore di Studi Musicali ""Toscanini""",,,,3101
4452,XK,prishtina,BPRAL RIINVEST SH A,,,,3102
4453,Italy,italy,Uniformazione S.R.L.,,,,3103
4454,Tajikistan,khujand,Institute of Economy and Trade of Tajik State University of Commerce,40.2833,69.6167,Sughd,3104
4455,Tunisia,kairouan,UNIVERSITY OF KAIROUAN,35.6833,10.1,Kairouan,3105
4456,Tajikistan,dushanbe,TAJIK STATE UNIVERSITY OF COMMERCE,38.5731,68.7864,Dushanbe,3106
4457,Kyrgyzstan,bishkek,INTERNATIONAL UNIVERSITY OF KYRGYZ REPUBLIC,42.8667,74.5667,Bishkek,3107
4458,Russian Federation,innopolis,"Autonomous noncommercial organization of higher education ""Innopolis University""",,,,3108
4459,China,beijing,Beijing Institute of Technology,39.905,116.3914,Beijing,3109
4460,China,shenzhen,"The Chinese University of Hong Kong, Shenzhen",22.535,114.054,Guangdong,3110
4461,Japan,fukuoka,Fukuoka University,33.6,130.4167,Fukuoka,3111
4462,Nepal,kathmandu,Apex College,27.7167,85.3667,Bāgmatī,3112
4463,Nigeria,ile ife,OBAFEMI AWOLOWO UNIVERSITY,,,,3113
4464,"Bolivia, Plurinational State of",la paz,UNIVERSIDAD MAYOR DE SAN ANDRES,-16.4942,-68.1475,La Paz,3114
4472,China,zhenjiang,Jiangsu University,32.2109,119.4551,Jiangsu,3115
4473,Russian Federation,tomsk,Federal State Educational Institution of Higher Professional Education Tomsk State University of Architecture and Building,56.4886,84.9522,Tomskaya Oblast’,3116
4474,Viet Nam,hanoi,TRUONG DAI HOC XAY DUNG,21.0245,105.8412,Hà Nội,3117
4475,Uzbekistan,andijon,ANDIJON MASHINASOZLIK INSTITUTI,40.7,72.35,Andijon,3118
4476,Argentina,rosario,UNIVERSIDAD NACIONAL DE ROSARIO - UNR,-32.9575,-60.6394,Santa Fe,3119
4484,Russian Federation,moscow,BAUMAN MOSCOW STATE TECHNICAL UNIVERSITY,55.7558,37.6178,Moskva,3120
4486,Argentina,cordoba,UNIVERSIDAD NACIONAL DE CORDOBA,-31.4167,-64.1833,Córdoba,3121
4492,Uganda,gulu,Gulu University,2.7667,32.3056,Gulu,3122
4493,Colombia,manizalez,UNIVERSIDAD DE CALDAS,,,,3123
4494,Brazil,salvador,UNIVERSIDADE FEDERAL DA BAHIA,-12.9708,-38.5108,Bahia,3124
4496,Algeria,el oued,UNIVERSITE D EL OUED,33.3683,6.8675,El Oued,3125
4497,Azerbaijan,khirdalan,BAKU ENGINEERING UNIVERSITY,,,,3126
4498,"Palestine, State of",gaza city,UNIVERSITY COLLEGE OF APPLIED SCIENCES,,,,3127
4499,Algeria,khemis-miliana,Djilali Bounaama Khemis-Miliana University,,,,3128
4500,Ukraine,kyiv,NATIONAL PEDAGOGICAl DRAGOMANOV UNIVERSITY,50.45,30.5236,"Kyyiv, Misto",3129
4501,Brazil,curitiba,UNIVERSIDADE TECNOLOGICA FEDERAL DO PARANA,-25.4297,-49.2719,Paraná,3130
4502,Azerbaijan,baku,Azerbaijan State University of Economics,40.3667,49.8352,Bakı,3131
4503,Egypt,fayoum,FAYOUM UNIVERSITY,,,,3132
4504,"Tanzania, United Republic of",dar-es-salaam,St. Joseph University in Tanzania,,,,3133
4505,Myanmar,yangon,UNIVERSITY OF MEDICINE 1,,,,3134
4506,Kyrgyzstan,bishkek,INTERNATIONAL SCHOOL OF MEDICINE INSTITUTION,42.8667,74.5667,Bishkek,3135
4507,Georgia,tbilisi,Georgian Institute of Public Affairs,41.7225,44.7925,Tbilisi,3136
4508,Ukraine,mariupil,DONETSK STATE UNIVERSITY OF MANAGEMENT,,,,3137
4509,Russian Federation,saransk,Ogarev Mordovia State University,54.1833,45.1833,Mordoviya,3138
4510,"Tanzania, United Republic of",dar es salaam,ARDHI UNIVERSITY,-6.8,39.2833,Dar es Salaam,3139
4511,Viet Nam,ho chi minh city,TRUONG DAI HOC QUOC TE,10.8167,106.6333,Hồ Chí Minh,3140
4512,Lithuania,siauliu,SIAULIU UNIVERSITETAS,,,,3141
4513,Lithuania,vilnius,TARPTAUTINE TEISES IR VERSLO AUKSTOJI MOKYKLA UAB,54.6833,25.2833,Vilniaus Miestas,3142
4514,Lithuania,panevezys,Panevezio kolegija,55.725,24.3639,Panevėžio Miestas,3143
4515,Lithuania,klaipeda,KLAIPEDOS UNIVERSITETAS,55.7075,21.1428,Klaipėdos Miestas,3144
4516,Lithuania,siauliai,Siauliu valstybine kolegija,55.9281,23.3167,Šiaulių Miestas,3145
4517,Lithuania,girionys,Kauno misku ir aplinkos inzinerijos kolegija,,,,3146
4518,Lithuania,kaunas,KAUNO KOLEGIJA,54.9,23.9333,Kauno Miestas,3147
4519,Lithuania,vilnius,"KAZIMIERO SIMONAVICIAUS UNIVERSITETAS, UAB",54.6833,25.2833,Vilniaus Miestas,3148
4520,Lithuania,vilnius,VILNIAUS TECHNOLOGIJU IR DIZAINO KOLEGIJA,54.6833,25.2833,Vilniaus Miestas,3149
4521,Lithuania,vilnius,ISM VADYBOS IR EKONOMIKOS UNIVERSITETAS UAB,54.6833,25.2833,Vilniaus Miestas,3150
4522,Lithuania,vilnius,VILNIAUS DAILES AKADEMIJA,54.6833,25.2833,Vilniaus Miestas,3151
4523,Lithuania,vilnius,SOCIALINIU MOKSLU KOLEGIJA,54.6833,25.2833,Vilniaus Miestas,3152
4524,Lithuania,vilnius,VILNIAUS KOLEGIJA,54.6833,25.2833,Vilniaus Miestas,3153
4525,Lithuania,vilnius,Vilniaus dizaino kolegija,54.6833,25.2833,Vilniaus Miestas,3154
4526,Lithuania,kaunas,Kauno technikos kolegija,54.9,23.9333,Kauno Miestas,3155
4527,Lithuania,klaipeda,Lietuvos verslo kolegija,55.7075,21.1428,Klaipėdos Miestas,3156
4528,Lithuania,klaipeda,Lietuvos aukstoji jureivystes mokykla,55.7075,21.1428,Klaipėdos Miestas,3157
4529,Lithuania,alytus,ALYTAUS KOLEGIJA,54.4014,24.0492,Alytaus Miestas,3158
4530,Lithuania,utena,Utenos kolegija,55.5,25.6028,Utena,3159
4531,Lithuania,vilnius,VIESOJI ISTAIGA EUROPOS HUMANITARINIS UNIVERSITETAS,54.6833,25.2833,Vilniaus Miestas,3160
4532,Lithuania,vilnius,Viesoji istaiga Vilniaus verslo kolegija,54.6833,25.2833,Vilniaus Miestas,3161
4533,Lithuania,vilnius,Generolo Jono Zemaicio Lietuvos karo akademija,54.6833,25.2833,Vilniaus Miestas,3162
4534,Ukraine,kyiv,HIGHER STATE EDUCATION INSTITUTION BANKING UNIVERSITY,50.45,30.5236,"Kyyiv, Misto",3163
4535,China,hangzhou,Zhejiang University of Science and Technology,30.25,120.1675,Zhejiang,3164
4536,Kazakhstan,almaty,EURASIAN TECHNOLOGICAL UNIVERSITY,43.25,76.9,Almaty,3165
4537,Ukraine,kharkiv,National University of Pharmacy,50.0,36.2292,Kharkivs’ka Oblast’,3166
4538,Japan,higashi-hiroshima,NATIONAL UNIVERSITY CORPORATION HIROSHIMA UNIVERSITY,34.4167,132.7333,Hiroshima,3167
4539,Cambodia,phnom penh,NATIONAL UNIVERSITY OF MANAGEMENT,11.5696,104.921,Phnom Penh,3168
4540,China,qionghai,Hainan College of Software Technology,,,,3169
4541,Ukraine,lviv,Lviv National Academy of Arts,49.8419,24.0315,L’vivs’ka Oblast’,3170
4542,Ukraine,kyiv,HIGHER EDUCATIONAL INSTITUTION OPENINTERNATIONAL UNIVERSITY OF HUMANDEVELOPMENT UKRAINE,50.45,30.5236,"Kyyiv, Misto",3171
4543,Ukraine,kyiv,"Kyiv college of construction, architecture and design",50.45,30.5236,"Kyyiv, Misto",3172
4544,Ukraine,odesa,NATIONAL UNIVERSITY ODESA LAW ACADEMY,46.4775,30.7326,Odes’ka Oblast’,3173
4545,Bangladesh,dhaka,American International University-Bangladesh,23.7289,90.3944,Dhaka,3174
4546,Bangladesh,dhaka,Daffodil International University,23.7289,90.3944,Dhaka,3175
4547,Azerbaijan,baku,AZERBAYCAN DOVLET IQTISAD UNIVERSITETI,40.3667,49.8352,Bakı,3176
4548,Ukraine,kharkiv,"National University""Yaroslav the Wise Law Academy of Ukraine""",50.0,36.2292,Kharkivs’ka Oblast’,3177
4549,United States,lawrenceville,Georgia Gwinnett College,33.9523,-83.9931,Georgia,3178
4551,Bosnia and Herzegovina,travnik,INTERNACIONALNI UNIVERZITET TRAVNIK,,,,3179
4552,XK,pristina,Kolegji AAB,42.6667,21.1667,Prishtinë,3180
4553,Viet Nam,ho chi minh,Ho Chi Minh City University of Technology and Education,,,,3181
4554,"Moldova, Republic of",chisinau,USPEE,47.0228,28.8353,Chişinău,3182
4555,Luxembourg,luxembourg-ville,UNIVERSITE DU LUXEMBOURG,,,,3183
4556,Senegal,dakar,Université Cheikh Anta Diop,14.7319,-17.4572,Dakar,3184
4557,Lao People's Democratic Republic,vientiane,NATIONAL UNIVERSITY OF LAOS,17.9667,102.6,Viangchan,3185
4558,Senegal,dakar,Université Catholique de l'Afrique de l'Ouest,14.7319,-17.4572,Dakar,3186
4559,Latvia,riga,SIA BIZNESA AUGSTSKOLA TURIBA,56.9475,24.1069,Rīga,3187
4561,Latvia,rezekne,REZEKNES TEHNOLOGIJU AKADEMIJA,56.5067,27.3308,Rēzeknes Novads,3188
4562,Latvia,riga,LATVIJAS KULTURAS AKADEMIJAS AGENTURA LATVIJAS KULTURAS AKADEMIJAS LATVIJAS KULTURAS KOLEDZA,56.9475,24.1069,Rīga,3189
4564,Latvia,riga,LATVIJAS KULTURAS AKADEMIJA,56.9475,24.1069,Rīga,3190
4566,Latvia,riga,Rigas Aeronavigacijas instituts,56.9475,24.1069,Rīga,3191
4568,Latvia,rīga,EKONOMIKAS UN KULTURAS AUGSTSKOLA,,,,3192
4569,Latvia,riga,Gramatvedibas un Finasu Koledza,56.9475,24.1069,Rīga,3193
4571,Latvia,jelgava,LATVIJAS LAUKSAIMNIECIBAS UNIVERSITATE,56.6522,23.7244,Jelgavas Novads,3194
4572,Latvia,daugavpils,DAUGAVPILS UNIVERSITATE,55.8714,26.5161,Daugavpils Novads,3195
4573,Latvia,riga,BALTIJAS STARPTAUTISKA AKADEMIJA,56.9475,24.1069,Rīga,3196
4575,Latvia,liepāja,Liepajas Jurniecibas koledza,,,,3197
4576,Latvia,riga,BIZNESA MAKSLAS UN TECHNOLOGIJU AUGSTSKOLA RISEBA,56.9475,24.1069,Rīga,3198
4578,Latvia,ventspils,VENTSPILS AUGSTSKOLA,57.3897,21.5644,Ventspils,3199
4579,Latvia,rīga,Alberta koledza,,,,3200
4580,Latvia,riga,LATVIJAS JURAS AKADEMIJA,56.9475,24.1069,Rīga,3201
4582,Latvia,riga,BANKU AUGSTSKOLA,56.9475,24.1069,Rīga,3202
4584,Latvia,valmiera,VIDZEMES AUGSTSKOLA,57.5381,25.4231,Valmiera,3203
4585,Latvia,riga,RIGAS STRADINA UNIVERSITATE,56.9475,24.1069,Rīga,3204
4587,Latvia,riga,RIGAS JURIDISKA AUGSTSKOLA,56.9475,24.1069,Rīga,3205
4589,Latvia,riga,Jazepa Vitola Latvijas Muzikas akademija,56.9475,24.1069,Rīga,3206
4591,Latvia,riga,LATVIJAS MAKSLAS AKADEMIJA,56.9475,24.1069,Rīga,3207
4593,Latvia,riga,RIGAS TEHNISKA UNIVERSITATE,56.9475,24.1069,Rīga,3208
4595,Latvia,riga,Transport and Telecommunication Institute,56.9475,24.1069,Rīga,3209
4597,Belarus,minsk,Belarusian State Academy of Music,53.9022,27.5618,Minsk,3210
4598,Russian Federation,saint petersburg,Federal State Educational Institution of Higher Education Saint Petersburg Stieglitz State Academy of Art and Design,59.95,30.3167,Sankt-Peterburg,3211
4599,Egypt,giza,NILE UNIVERSITY,29.987,31.2118,Al Jīzah,3212
4600,Libya,tripoli,UNIVERSITY OF TRIPOLI,32.8752,13.1875,Ţarābulus,3213
4603,Mexico,hermosillo,UNIVERSIDAD DE SONORA,29.0989,-110.9542,Sonora,3214
4604,Russian Federation,grozny,Chechen State Pedagogical University,,,,3215
4605,Russian Federation,tver,TVER STATE UNIVERSITY,56.8578,35.9219,Tverskaya Oblast’,3216
4606,Bosnia and Herzegovina,bijeljina,UNIVERZITET SINERGIJA BIJELJINA,44.75,19.2167,"Srpska, Republika",3217
4607,India,amarkantak,Indira Gandhi National Tribal University,22.6751,81.7596,Chhattīsgarh,3218
4608,Lesotho,maseru,NATIONAL UNIVERSITY OF LESOTHO,-29.31,27.48,Maseru,3219
4609,Belarus,gorki,BELARUSIAN STATE OF THE ORDERS OF THE OCTOBER REVOLUTION AND OF THE LABOR RED BANNER AGRICULTURAL ACADEMY,,,,3220
4610,Russian Federation,st petersburg,STATE INSTITUTE OF TECHNOLOGY SAINTPETERSBURG RUSSIA,,,,3221
4611,Belarus,baranovichi,"Institution of education ""Baranovichi State University""",,,,3222
4612,North Macedonia,skopje,European University - Republic of Macedonia,41.9833,21.4333,Skopje,3223
4613,North Macedonia,bitola,UNIVERSITY ST KLIMENT OHRIDSKI BITOLA,41.0319,21.3347,Bitola,3224
4614,North Macedonia,tetovo,SOUTH EAST EUROPEAN UNIVERSITY TETOVO,42.0103,20.9714,Tetovo,3225
4615,North Macedonia,skopje,"Private independent higher institution Higher professional school Business Academy Smilevski - BAS, Skopje",41.9833,21.4333,Skopje,3226
4616,North Macedonia,skopje,UNIVERZITET MAJKA TEREZA VO SKOPJE,41.9833,21.4333,Skopje,3227
4617,North Macedonia,skopje,PRIVATE HIGHER EDUCATION INSTITUTION - UNIVERSITY AMERICAN COLLEGE SKOPJE PRIVATNA USTANOVA,41.9833,21.4333,Skopje,3228
4618,North Macedonia,struga,International University of Struga,41.1775,20.6789,Struga,3229
4619,North Macedonia,skopje,INTERNATIONAL BALKAN UNIVERSITY,41.9833,21.4333,Skopje,3230
4620,North Macedonia,skopje,Ss. CYRIL AND METHODIUS UNIVERSITY IN SKOPJE,41.9833,21.4333,Skopje,3231
4621,North Macedonia,ohrid,REPUBLIC OF MACEDONIA - UNIVERSITY FOR INFORMATION SCIENCE AND TECHNOLOGY ST.PAUL THE APOSTLE OHRID,41.1169,20.8019,Ohrid,3232
4622,North Macedonia,skopje aerodrom,INTEGRATED BUSINESS FACULTY PU,,,,3233
4623,North Macedonia,skopje,Institut za opstestveni i humanisticki nauki Skopje,41.9833,21.4333,Skopje,3234
4624,North Macedonia,tetovo,UNIVERZITET VO TETOVO,42.0103,20.9714,Tetovo,3235
4625,North Macedonia,skopje,Institut za KOMUNIKACISKI STUDII Skopje,41.9833,21.4333,Skopje,3236
4626,Malta,paola,MALTA COLLEGE OF ARTS SCIENCE AND TECHNOLOGY,35.8731,14.4989,Paola,3237
4629,Malta,msida,UNIVERSITA TA MALTA,,,,3238
4630,Malta,st julians,INSTITUTE OF TOURISM STUDIES,,,,3239
4631,Netherlands,rotterdam,"Codarts, University for the Arts",51.9225,4.4792,Zuid-Holland,3240
